Title,News,Topic
Kelangkaan Chip Otomotif Diprediksi Berlangsung Hingga 2023,"REPUBLIKA.ID REPUBLIKA TV GERAI IHRAM REPJABAR REPJOGJA RETIZEN BUKU REPUBLIKA Sunday, 26 Safar 1443 / 03 October 2021 Home > Oto Tek > Otomotif Kelangkaan Chip Otomotif Diprediksi Berlangsung Hingga 2023 Ahad 12 Sep 2021 09:26 WIB Penurunan produksi mobil merek ternama masih terjadi karena sulit menapatkan chip (Foto: ilustrasi mobil listrik menggunakan chip) Penurunan produksi mobil merek ternama masih terjadi karena sulit menapatkan chip. REPUBLIKA.CO.ID, JAKARTA -- Kelangkaan dan kurangnya pasokan ""chip"" yang turut menganggu produk mobil secara global bisa bertahan hingga 2023. Kabar itu diperkuat dari berbagai pihak termasuk pada jenama mobil mewah asal Jerman Mercedez-Benz yang di kuartal ketiga 2021 mengalami penurunan produksi dan penjualan secara signifikan karena sulitnya mendapatkan chip. ""Produsen chip menyebutkan kondisi itu akan terus berlanjut hingga 2022 secara struktural dan kemudian perlahan membaik. Artinya kelangkaan bisa terjadi hingga 2023,"" kata Kepala dari Mercedes-Benz Kallenius seperti dikutip dari BBC, Ahad (12/9). 5 Makanan Kaya Antioksidan yang Bantu Turunkan Berat Badan KM Tidar Disiapkan untuk Isolasi Covid Saat PON XX Papua Masjid Sunshine, Rona Utsmaniyah di Negeri Kanguru Ia berharap secara global kelangkaan pasokan chip tidak sampai membuat industri lainnya mengalami penurunan dari berbagai aspek seperti yang tengah dialami oleh Mercedes-Benz dalam beberapa bulan terakhir. Kallenius menyebutkan, pandemi merupakan ujian tekanan dan bahkan mengibaratkannya sebagai sebuah kemacetan lalu lintas bagi industri otomotif, yang butuh waktu untuk kembali mengurai dan membuat jalan menjadi lancar. ""Kita harus belajar dari ujian tekanan ini dan melihat lebih jauh ke depan seluruh pihak yang terlibat dalam rantai pasokan chip agar bisa membuat sistem yang lebih kuat lagi,"" ujar Kallenius. Pandemi COVID-19 menjadi ujian tekanan tidak hanya bagi industri otomotif tapi juga lintas industri yang mengandalkan chip untuk memenuhi kebutuhan sehari-hari masyarakat yang kini tak bisa lepas dari teknologi. Analis dari Gartner yang merupakan perusahaan riset teknologi global, Koray Kose, menyebutkan selain kelangkaan. Tekanan lainnya yang kini tengah dihadapi oleh industri chip adalah persiapanmenyambut jaringan 5G. Disusul juga denganlarangan Amerika Serikat kepada para pemilik teknologi semikonduktor untuk menjual produknya kepada Huawei.Hal itu menyebabkan pembuat chip di luar AS kebanjiran pesanan dari China. Ketika pandemi berlangsung, tanda-tanda awal permintaan untuk chip berfluktuasi menyebabkan penimbunan dan pemesanan chip di muka oleh beberapa perusahaan teknologi sehingga membuat pemain lain harus berjuang untuk mendapatkan komponen. Masyarakat secara global yang bekerja dari rumah membutuhkan laptop, tablet, dan webcam untuk membantu mereka melakukan pekerjaan mereka padahal dan pabrik-pabrik chip tutup selama lockdown. Hal itu menyebabkan tak sedikit konsumen berjuang untuk membeli perangkat yang mereka inginkan, meski pada akhirnya produsen sejauh ini selalu mampu memenuhi permintaan pada akhirnya. Kabar kelangkaan chip yang diperkirakan akan terjadi hingga 2023 turut dibenarkan oleh raksasa teknologi di industri komputer.\Baik Kepala eksekutif Intel dan IBM turut menyebutkan hal serupa. BACA JUGA: Ikuti Serial Sejarah dan Peradaban Islam di Islam Digest , Klik di Sini Tesla Roadster Baru akan Dikirim ke Pemesan pada 2023 Kelangkaan Chip Diperkirakan Berlanjut Hingga Tahun Depan Mercedes Benz Indonesia Mulai Terdampak Kelangkaan Chip Kelangkaan Chip Mulai Pengaruhi Industri Sepeda Motor         Dapatkan Update Berita Republika Rangkaian Pembukaan Pekan Olahraga Nasional XX Papua (2) PON XX: Siapa Dampingi Tim Sepak Bola Papua ke 6 besar? Rangkaian Pembukaan Pekan Olahraga Nasional XX Papua (1) Mantan Atlet: PON Papua Berdampak Baik Bagi Indonesia Timur Live; Barcelona Kembali Telan Kekalahan Setelah dibantai Benfica beberapa hari lalu, kini Barca ditekuk Atletico Madrid. Unsiq Rintis Kampung Laboratorium Kreatif Berbasis Limbah Kampung laboratorium ini akan menjadi ruang belajar terbuka untuk mengolah limbah. 48 Atlet Aeromodeling Berebut Medali di PON XX Papua Cabor ini diikuti oleh 12 provinsi. Live; Menang Tipis Kontra Sassuolo, Inter Tempel Napoli Kini Inter hanya tertinggal satu poin. Kasoem Vision Care Kedepankan Kelengkapan Tes Mata Pemeriksaan ini, kata dia, tidak memiliki batasan usia. Menparekraf Sambangi Desa Wisata Cikolelet, Serang Diabetes hilang selamanya & pankreas kembali sehat! 100% alami Mercedes Benz Indonesia Mulai Terdampak Kelangkaan Chip Tak Perlu Laser jika Mata Mulai Kabur! Ternyata Cukup Lakukan Ini Kelangkaan Chip Bikin Konsumen Mercedes Benz Inden Setahun Anda wajib minum ini! Agar tensi 120/80 dan pembuluh darah bersih Wuling Bakti Pendidikan Gandeng SMK Taruna Bangsa Cara memulihkan penglihatan hingga 126% di rumah GIIAS Batal, Inilah Konsep Pameran Baru Gaikindo Kelangkaan  Chip Mulai Pengaruhi Produksi Honda di Indonesia Gadis ini hasilkan 12 miliar rupiah dalam 28 hari dengan cara ini Lelaki Jakarta Temukan Cara Tumbuhkan Rambut dalam Hitungan Hari Auto2000 Donasi 23 Ribu Paket Sembako ke Warga Terdampak Kisah Sukses Batik Ruzza Pekalongan Tembus Pasar Ekspor Ahad , 03 Oct 2021, 00:09 WIB Solskjaer Yakin Strateginya Sudah Tepat Pembangunan Masjid 1001 Kubah di Sambas Banjir Dukungan Diimbangi Persib, Milo: PSM Hanya Kurang Beruntung In Picture: Persija Bekap Persiaraja 1-0 di Stadion Pakansari Bogor Bhayangkara FC Ingin Sapu Bersih Seri Pertama Jokowi Resmikan Gedung Papua Muda Inspiratif Sabtu , 02 Oct 2021, 19:32 WIB Tips Menjaga Kesehatan Jantung Saat Pandemi Waspada Cuaca Buruk di Peralihan Musim Jl. Warung Buncit Raya No 37 Jakarta Selatan 12510 ext 308 Phone: 021 780 3747 Fax: 021 799 7903 ABOUT US DISCLAIMER PRIVACY POLICY PEDOMAN SIBER PETA SITUS",4
Uni Eropa Target Gandakan Produksi Chip dalam 10 Tahun,"Ekonomi AS Kembali Memanas, Wall Street Ditutup Melesat Coinbase Dibobol, Hacker Curi Uang Kripto dari 6.000 Pelanggan HOME EKONOMI APBN PAJAK INDUSTRI INFRASTRUKTUR ENERGI TRADE TRANSLOG PROPERTI EKONOMI GLOBAL Home Ekonomi & bisnis Ekonomi Global Uni Eropa Target Gandakan Produksi Chip dalam 10 Tahun Uni Eropa akan melakukan pendanaan yang signifikan untuk memperluas manufaktur semikonduktor. Reni Lestari - Bisnis.com 14 Juli 2021  |  10:05 WIB Lambang Uni Eropa terpampang di depan gedung Parlemen Eropa di Brussels, Belgia, Rabu (27/5/2020). - Bloomberg/Geert Vanden Wijngaert Bisnis.com, JAKARTA - Komisaris Industri Uni Eropa Thierry Breton mengatakan blok itu bertujuan untuk meningkatkan produksi chip menjadi 20 persen dari pasokan global dalam 10 tahun ke depan. Dilansir Channel News Asia, Rabu (14/7/2021), menurut komentar yang dikeluarkan oleh menteri industri Italia setelah pertemuan, saat ini blok ekonomi itu menyumbang 10 persen dari produksi dunia. Pada Mei lalu, Breton mengatakan Uni Eropa akan melakukan pendanaan yang signifikan untuk memperluas manufaktur semikonduktor. Baca Juga : Harga Memory Naik, Kinerja Samsung Lampaui Perkiraan Analis Sebelumnya diketahui kelangkaan chip global telah menyebabkan gangguan produksi barang-barang mulai dari elektronik konsumen hingga otomotif. Sejumlah pabrikan mobil bahkan terpaksa menutup kawasan produksi karena ketiadaan pasokan chip. Dilansir Bloomberg, kekurangan chip global berdampak pada pemulihan ekonomi Inggris pada Mei, mengganggu manufaktur dan menjatuhkan produksi mobil dan truk pada salah satu tingkat tercepat dalam catatan. Pertumbuhan ekonomi secara keseluruhan melambat menjadi 0,8 persen, sekitar setengah dari tingkat yang diharapkan. Baca Juga : Krisis Chip Global Memburuk, Waktu Tunggu Pemesanan Jadi 18 Minggu Namun di Jerman, lonjakan permintaan global setelah berakhirnya penguncian akibat pandemi Covid-19 memiliki dampak yang beragam. Beberapa indikator menyoroti perjuangan mereka yang berkelanjutan dengan masalah rantai pasokan yang belum pernah terjadi sebelumnya. Permintaan yang kuat menunjukkan hari-hari ke depan yang lebih baik untuk pabrik, tetapi sektor ini tidak mungkin berkontribusi banyak terhadap pertumbuhan kuartal ini, menurut Maeva Cousin dari Bloomberg Economics. Simak Video Pilihan di Bawah Ini : Simak berita lainnya seputar topik artikel ini, di sini : Editor : Hadijah Alaydrus Konten Premium Nikmati Konten Premium Untuk Informasi Yang Lebih Dalam Masuk / Daftar Langkah Kuda BTPN Syariah (BTPS) Bertarung Hadapi... Unilever (UNVR) dan Strategi Tarik Mantan Petinggi... Menanti Tuah Ambisi Grup MNC dari Lini Bisnis... Subscribe Newsletter Bisnis Indonesia Bergabung dan dapatkan analisis informasi ekonomi dan bisnis melalui email Anda. Kala Inggris Kepincut Fintech Indonesia, Investasi… Uni Eropa Batasi Ekspor Vaksin Covid-19, Mengapa? ANTIMONOPOLI UNI EROPA : Google Ajukan Pembatalan… Makin Panas! Google Gugat Keputusan Komisi Eropa Soal… Indeks Manufaktur Ekspansif, Honda Masih Ragu Genjot… Krisis Cip Makin Parah, Mercedes-Benz Tunda Pengiriman… Pasokan Cip Otomotif Masih Ketat, Produksi Mobil Dunia… Penjualan BMW Tak Terdampak Kelangkaan Chip, Pasar… Tak Perlu Laser jika Mata Mulai Kabur! Ternyata Cukup Lakukan Ini Belajar dari China dan Inggris, Bauran EBT Perlu Dioptimalkan Rolex - Jual Jam Tangan Terbaru di Indonesia Kemenaker Ingin Produktivitas Indonesia Lebih Ramah Lingkungan Diabetes hilang selamanya & pankreas kembali sehat! 100% alami Krisis Pasokan Listrik China Pukul Industri Manufaktur Resep ini membuat ukuran pada wanita lebih besar dalam 5 hari Industri Kosmetika Diproyeksi Tumbuh 7 Persen Tahun Ini Menparekraf: Industri Batik Mampu Serap Lebih dari 200.000 Tenaga Kerja Menteri Pariwisata dan Ekonomi Kreatif Sandiaga Salahuddin Uno menyebutkan bahwa industri batik berhasil menggerakkan ekonomi masyarakat dengan menyerap lebih dari 200.000… Pembangunan Jalan di Ibu Kota Negara Baru Habiskan Rp275 Miliar Penanganan infrastruktur jalan di wilayah Kecamatan Sepaku, Kabupaten Penajam Paser Utara, Kalimantan Timur sebagai penunjang ibu kota negara Indonesia yang baru menghabiskan… 3 Bulan Luncurkan Xpora, BNI Telah Kucurkan Kredit Ekspor Rp1 Triliun PT Bank Negara Indonesia (Persero) Tbk. telah mengucurkan kredit ekspor senilai Rp1 triliun selama 3 bulan sejak program Xpora diluncurkan pada Juni 2021. Perusahaan menyatakan… Dukung PON XX, Begini Strategi Kementerian ESDM Amankan Listrik di Papua Kementerian Energi dan Sumber Daya Mineral (ESDM) turut mendukung suksesnya pelaksanaan Pekan Olahraga Nasional (PON) XX di Papua dengan memastikan keandalan listrik pada… Berikut Ini Program 100 Hari Pasca Merger Pelindo Nilai IPO Global Melambat pada Kuartal III, Pengaruh Efek China? PMI Indonesia Lebih Agresif dibandingkan China, Ini Kata Menperin PGN Optimalisasi Infrastruktur Transmisi Layanan Gas Jawa Tengah Bocah Bisa Buka Tuas Pintu Darurat, Ini Kronologi Lengkapnya Versi Citilink Tengok Strategi Waskita Karya (WSKT) Tebus Utang Rp90 Triliun Mendag Lutfi Blak-Blakan Soal Peta Jalan Ekonomi Digital, Apa Isinya? Konsumsi Baja Besar Tapi Impor Mendominasi, Ini Kata Jokowi Download Aplikasi E-Paper sekarang dan dapatkan FREE AKSES selama 7 hari! Kemeriahan Pembukaan PON XX Papua Jakarta Banten Bandung Semarang Bali Sumatra Surabaya Kalimantan Sulawesi Papua Copyright © 2021 - Bisnis Indonesia. About us Privacy Policy Code of Conduct Advertise with us Contact Us Career",4
Kelangkaan  chip  di industri otomotif bisa sampai 2023,"ANTARANEWS.COM TERKINI TOP NEWS TERPOPULER Sunday , Oct 3 , 2021 Home Umum Kelangkaan ""chip"" di industri otomotif bisa sampai 2023 Kelangkaan ""chip"" di industri otomotif bisa sampai 2023 12 September 2021 08:16 Ilustrasi - Chip. Perusahaan teknologi Samsung Electronics dan perusahaan mesin pencari Baidu mengumumkan telah menyelesaikan pengembangan chip AI cloud-to-edge pertama Baidu, Baidu KUNLUN, dan akan memproduksi secara massal awal tahun depan. ANTARA/news.samsung.com Jakarta (ANTARA) - Kelangkaan dan kurangnya pasokan ""chip"" yang turut menganggu produk mobil secara global bisa bertahan hingga 2023. Kabar itu diperkuat dari berbagai pihak termasuk pada jenama mobil mewah asal Jerman Mercedez-Benz yang di kuartal ketiga 2021 mengalami penurunan produksi dan penjualan secara signifikan karena sulitnya mendapatkan chip. ""Produsen chip menyebutkan kondisi itu akan terus berlanjut hingga 2022 secara struktural dan kemudian perlahan membaik. Artinya kelangkaan bisa terjadi hingga 2023,"" kata Kepala dari Mercedes-Benz Kallenius seperti dikutip dari BBC, Minggu. Ia berharap secara global kelangkaan pasokan chip tidak sampai membuat industri lainnya mengalami penurunan dari berbagai aspek seperti yang tengah dialami oleh Mercedes-Benz dalam beberapa bulan terakhir. Kallenius menyebutkan pandemi merupakan ujian tekanan dan bahkan mengibaratkannya sebagai sebuah kemacetan lalu lintas bagi industri otomotif, yang butuh waktu untuk kembali mengurai dan membuat jalan menjadi lancar. ""Kita harus belajar dari ujian tekanan ini dan melihat lebih jauh ke depan seluruh pihak yang terlibat dalam rantai pasokan chip agar bisa membuat sistem yang lebih kuat lagi,"" ujar Kallenius. Pandemi COVID-19 menjadi ujian tekanan tidak hanya bagi industri otomotif tapi juga lintas industri yang mengandalkan chip untuk memenuhi kebutuhan sehari-hari masyarakat yang kini tak bisa lepas dari teknologi. Analis dari Gartner yang merupakan perusahaan riset teknologi global, Koray Kose, menyebutkan selain kelangkaan. Tekanan lainnya yang kini tengah dihadapi oleh industri chip adalah persiapan menyambut jaringan 5G. Disusul juga dengan larangan Amerika Serikat kepada para pemilik teknologi semikonduktor untuk menjual produknya kepada Huawei. Hal itu menyebabkan pembuat chip di luar AS kebanjiran pesanan dari China. Ketika pandemi berlangsung, tanda-tanda awal permintaan untuk chip berfluktuasi menyebabkan penimbunan dan pemesanan chip di muka oleh beberapa perusahaan teknologi sehingga membuat pemain lain harus berjuang untuk mendapatkan komponen. Masyarakat secara global yang bekerja dari rumah membutuhkan laptop, tablet, dan webcam untuk membantu mereka melakukan pekerjaan mereka padahal dan pabrik-pabrik chip tutup selama lockdown. Hal itu menyebabkan tak sedikit konsumen berjuang untuk membeli perangkat yang mereka inginkan, meski pada akhirnya produsen sejauh ini selalu mampu memenuhi permintaan pada akhirnya. Kabar kelangkaan chip yang diperkirakan akan terjadi hingga 2023 turut dibenarkan oleh raksasa teknologi di industri komputer. Baik Kepala eksekutif Intel dan IBM turut menyebutkan hal serupa. Baca juga: Intel akan investasi Rp1.300 triliun untuk produksi chip di Eropa Baca juga: Krisis chip, Toyota akan kurangi produksi di Jepang dan Amerika Baca juga: Volvo hentikan produksi di Swedia karena krisis chip Copyright © ANTARA 2021 Toyota pangkas target produksi imbas kekurangan suku cadang dan chip VW masih punya pekerjaan berat untuk bisa menciptakan perangkat lunak Renault Megane EV akan pakai chip Qualcomm Daimler: Perusahaan otomotif bisa hadapi kekurangan chip hingga 2023 GM kembali kurangi produksi di Amerika karena kelangkaan chip Scania hentikan produksi truk di tiga pabrik Eropa Motor listrik BL-SEV01 sukses jalani uji coba Jakarta-Mandalika GM akan gunakan 100 persen energi terbarukan pada 2025 GAC akan ekspor kendaraan Dodge Journey ke pasar Meksiko pekan ini Lotus Emira V6 akan segera meluncur di AS Wuling resmi jalankan program ""Wuling Bakti Pendidikan"" Evalube resmi buka toko online di marketplace terkemuka Optimalkan kinerja mesin dengan pelumas yang tepat Lima fakta unik Michelin Gran Turismo Sport Indonesia Series 2021 GM buat motor listrik baru, bisa suguhkan 1000 tenaga kuda Toyota Tundra versi TRD Pro akan berlomba di NASCAR Truck Series Evalube resmi buka toko online di marketplace terkemuka Ineos Grenadier mulai buka pemesanan akhir September Motor listrik BL-SEV01 sukses jalani uji coba Jakarta-Mandalika GM akan gunakan 100 persen energi terbarukan pada 2025 GAC akan ekspor kendaraan Dodge Journey ke pasar Meksiko pekan ini Optimalkan kinerja mesin dengan pelumas yang tepat Lima fakta unik Michelin Gran Turismo Sport Indonesia Series 2021 GM buat motor listrik baru, bisa suguhkan 1000 tenaga kuda",4
Scania hentikan produksi truk di tiga pabrik Eropa,"ANTARANEWS.COM TERKINI TOP NEWS TERPOPULER Sunday , Oct 3 , 2021 Home Umum Scania hentikan produksi truk di tiga pabrik Eropa Scania hentikan produksi truk di tiga pabrik Eropa 31 Agustus 2021 07:15 Jakarta (ANTARA) - Produsen truk Scania pada pekan ini menghentikan produksi di tiga pabrik Eropa (Belanda, Swedia dan Prancis) karena kelangkaan pasokan chip semi-konduktor, lapor Reuters pada Senin (30/8). ""Untuk sementara waktu kami memperlambat volume produksi,"" kata juru bicara Scania, Karin Hallstan. Karin menambahkan, kelangkaan pasokan chip semi-konduktor tidak hanya melanda pabrik mereka di Eropa. Pada pekan depan, Scania juga akan menyetop pabrik di Amerika Selatan. ""Sekarang mereka bertahan selama beberapa hari ketika kami melakukan (penundaan produksi) di Eropa,"" katanya. Kelangkaan pasokan chip semi-konduktor telah mengganggu operasional perusahaan di Swedia, menurut survei yang diterbitkan Silf-Swedbank. Menurut survei, 16 persen perusahaan merevisi rencana produksi untuk enam bulan mendatang karena Kelangkaan pasokan chip semi-konduktor. Produsen asal Swedia lainnya, Volvo Cars, juga mengumumkan bahwa mereka akan menghentikan produksi di pabrik Gothenburg selama sepekan. Baca juga: Scania resmi beli perusahaan truk di China Baca juga: Scania akan PHK 5.000 pegawai secara global Baca juga: Corona paksa Scania hentikan sementara produksi truk untuk Eropa Copyright © ANTARA 2021 Sejumlah perusahaan tarik 300 kendaraan karena suku cadang rusak Kelangkaan ""chip"" di industri otomotif bisa sampai 2023 VW masih punya pekerjaan berat untuk bisa menciptakan perangkat lunak Renault Megane EV akan pakai chip Qualcomm Daimler: Perusahaan otomotif bisa hadapi kekurangan chip hingga 2023 GM kembali kurangi produksi di Amerika karena kelangkaan chip Motor listrik BL-SEV01 sukses jalani uji coba Jakarta-Mandalika GM akan gunakan 100 persen energi terbarukan pada 2025 GAC akan ekspor kendaraan Dodge Journey ke pasar Meksiko pekan ini Lotus Emira V6 akan segera meluncur di AS Wuling resmi jalankan program ""Wuling Bakti Pendidikan"" Evalube resmi buka toko online di marketplace terkemuka Optimalkan kinerja mesin dengan pelumas yang tepat Lima fakta unik Michelin Gran Turismo Sport Indonesia Series 2021 GM buat motor listrik baru, bisa suguhkan 1000 tenaga kuda Toyota Tundra versi TRD Pro akan berlomba di NASCAR Truck Series Evalube resmi buka toko online di marketplace terkemuka Ineos Grenadier mulai buka pemesanan akhir September Motor listrik BL-SEV01 sukses jalani uji coba Jakarta-Mandalika GM akan gunakan 100 persen energi terbarukan pada 2025 GAC akan ekspor kendaraan Dodge Journey ke pasar Meksiko pekan ini Optimalkan kinerja mesin dengan pelumas yang tepat Lima fakta unik Michelin Gran Turismo Sport Indonesia Series 2021 GM buat motor listrik baru, bisa suguhkan 1000 tenaga kuda",4
La pénurie de puces continue de poser de gros problèmes aux constructeurs automobiles,"Continuer sans accepter → ZDnet et ses partenaires souhaitent utiliser des cookies ou autres traceurs et traiter vos données personnelles (données de navigation, données renseignées dans votre compte et/ou lors de l'utilisation des services, etc.) pour : - Fonctionnalités liées aux réseaux sociaux, - Fonctionnalités liées à l'amélioration de votre expérience, - Contenu personnalisé et mesure de performance du contenu, - Publicités personnalisées, mesure de performance des publicités et données d'audience, - Développer et améliorer les produits, - Données de géolocalisation précises et identification par analyse du terminal, Vous pouvez autoriser ou refuser tout ou partie de ces traitements de données qui sont basés sur votre consentement ou sur l'intérêt légitime de nos partenaires, à l'exception des cookies et/ou traceurs nécessaires au fonctionnement de ce site. Vous pouvez modifier vos choix à tout moment en cliquant sur ""Préférences cookies"" au bas de chaque page. Pour en savoir plus, consultez notre politique de protection des données personnelles. GUIDE PRATIQUE: mieux travailler au bureau et à distance avec les conseils et astuces de ZDNet Accueil > News > Automobile La pénurie de puces continue de poser de gros problèmes aux constructeurs automobiles Technologie : L'industrie automobile doit faire face à une perte de revenus de 210 milliards de dollars en raison de la pénurie mondiale de semi-conducteurs. Par Liam Tung | Vendredi 24 Septembre 2021 Dossiers IT à découvrir",6
