Title,News,Topic
Menperin Targetkan RI Produksi Chip untuk Mobil dan Laptop,"Menperin Targetkan RI Produksi Chip untuk Mobil dan Laptop fea, CNN Indonesia | Rabu, 01/09/2021 11:41 WIB Ilustrasi produksi mobil di Indonesia. (Astra Daihatsu Motor) Jakarta, CNN Indonesia -- Menteri Perindustrian Agus Gumiwang mewacanakan chip semikonduktor yang saat ini pasokannya terbatas di dunia bakal diproduksi di Indonesia. Agus menilai industri chip menjadi strategis sejalan perkembangan industri 4.0. Menurut dia agar mencapai target tersebut perlu kebijakan khusus dan insentif untuk membuka peluang investasi industri chip semikonduktor. ""Untuk mencapai target tersebut, tentu dibutuhkan dukungan pemerintah berupa kebijakan dan kemudahan baik fiskal maupun non fiskal. Pemberian insentif dalam rangka penanaman modal merupakan salah satu upaya mendorong investasi industri semikonduktor di Indonesia,"" kata Agus di webminar ""Peluang Industri Indonesia Terkait Isu Global Chip Shortage"", dilansir dari Antara, Selasa (31/8). Menyoal Chip Semikonduktor yang Bikin Pusing Otomotif Dunia Krisis chip semikonduktor terjadi semasa pandemi Covid-19, salah satu dampak terbesar dirasakan industri otomotif global termasuk di Indonesia. Banyak pabrik otomotif tutup lantaran pandemi, kemudian pasokan chip beralih jadi lebih banyak diserap industri perangkat elektronik seperti komputer, laptop, dan gawai lain yang tumbuh ketika banyak orang beraktivitas di rumah saja. Saat pabrik otomotif mulai beroperasi lagi, pasokan chip tak bisa kembali normal sehingga produksi mobil banyak tertunda. Membangun industri chip di Indonesia dikatakan agus butuh waktu beberapa tahun untuk mendirikan pabrik dengan investasi cukup besar dan perlu ketersediaan insinyur berkualitas karena kompleksitas desain hingga manufaktur chip. ""Tantangan ini memberikan peluang baru bagi industri dan start up investor Indonesia untuk melakukan kontrak manufacturing chip yang sedang tumbuh di berbagai negara terutama AS, Jepang, China, Taiwan, Korea Selatan dan negara negara Eropa,"" kata Agus. Agus mengungkap pada 1973 sudah pernah berdiri industri komponen chip semikonduktor di dalam negeri, hasil investasi dua perusahaan multinasional AS yaitu Fairchild Semiconductors dan National Semiconductors. Namun pada 1985 kedua perusahaan angkat kaki sehingga Indonesia menjadi negara mayoritas pengimpor chip semikonduktor. ""Dengan terjadinya peristiwa Global Chip Shortage saat ini kita sadar penuh betapa pentingnya untuk menyiapkan rantai pasok yang aman bagi tersedianya suplai komponen chip semikonduktor di dalam negeri,"" ujar Agus. Terkendala Pasokan Chip, 3 Pabrikan Mobil Jepang Tutup Model bisnis industri chip semikonduktor dijelaskan Agus kini tak lagi dikuasai satu perusahaan yang meliputi hulu ke hilir. Kata dia saat ini sudah terpecah menjadi beberapa bagian, yakni Fabless (Chip Design), Foundry (Chip Fabrication), IDM (Chip Design & Fabrication), dan OSAT (Assembly & Test). ""Indonesia berkeinginan untuk ikut berpartisipasi dalam rantai nilai industri semikonduktor dunia melalui kerja sama dengan berbagai Mitra MultiNational Companies (MNCs) dan perusahaan start-up di seluruh dunia,"" papar Agus. Saksikan Video di Bawah Ini: VIDEO: Perpanjangan PPNBM 100 Persen Tunggu PMK Industri Otomotif Jepang Surut Dihantam Covid-19 Hari Ini Terakhir Bisa Beli Mobil Baru PPnBM 100 Persen Riwayat 6 Bulan PPnBM 100 Persen yang Diusulkan Diperpanjang Lexus soal Produksi Mobil di RI: Belum Ada Informasi Krisis Chip, Produksi Toyota Diproyeksi Ambles 90 Ribu Unit Kemenperin: PMI Manufaktur RI Lampaui China per September Menperin: Daya Beli Furnitur Masyarakat Tinggi Saat Corona Menperin Usul Diskon PPnBM Mobil Baru Diperpanjang Menperin Ungkap Produk Impor Gampang Masuk Indonesia Waktu Terbaik Berhubungan Seks, Pria dan Wanita Berbeda Pakar: UMKM Harus Siap ke Arah Digitalisasi Pantangan Makanan Bagi Pria Bertetek Besar Ahli Seks Ungkap 5 Cara Dapatkan Kepuasan Seks Terbaik Pria Jangan Terburu-buru saat Berhubungan Seks 7 Kesalahan Pria saat Hubungan Seks Tautan Sponsor oleh Taboola VIDEO: Impresi City Hatchback, Harus Bisa Move On dari Jazz VIDEO: Digoda Fitur Canggih Wuling Almaz RS VIDEO: Rayuan SUV Miliaran Hyundai Palisade buat Para Sultan 5 Aparat Tewas Disergap Milisi Taliban Pakistan 27 menit yang lalu Pemerintah Pakistan menyatakan empat tentara dan satu orang polisi tewas dibunuh oleh kelompok Taliban dalam serangan pada Sabtu (2/10). Presiden Filipina Rodrigo Duterte Umumkan Mundur dari Politik 10 jam yang lalu Cerita Sharon Jadi Menteri BUMN Sehari Gantikan Erick Thohir 15 jam yang lalu Edo Kondologit-Raffi Ahmad Bakal Ramaikan Pembukaan PON Papua 16 jam yang lalu Hasil Kualifikasi MotoGP Amerika: Bagnaia Pole, Marquez Ke-3 Olahraga • 56 menit yang lalu VIDEO: Lukisan Karya Petinju Muhammad Ali Dilelang Rp5,4 M Hiburan • 57 menit yang lalu Satu Sisi Ahmad Dhani Hiburan • 1 minggu yang lalu Masjid Wal Adhuna, Saksi Bisu Tenggelamnya Daratan Jakarta Nasional • 21 jam yang lalu Alasan Winger Everton Tiru Selebrasi Ronaldo Olahraga • 1 jam yang lalu Land Rover Pop Up Display Bertema James Bond di Jakarta Teknologi • 2 jam yang lalu Fakta-fakta 18 Pesawat Tempur TNI Melintasi Istana Merdeka 7 jam yang lalu Cara Mengetahui WA Sudah Dibaca Meski Centang Biru Nonaktif 9 jam yang lalu Motor Listrik Buatan Lokal Sukses Jajal Jakarta-Mandalika 8 jam yang lalu Menyajikan berita terhangat langsung melalui handphone Anda © 2021 Trans Media, CNN name, logo and all associated elements (R) and © 2021 Cable News Network, Inc. A Time Warner Company. All rights reserved. CNN and the CNN logo are registered marks of Cable News Network, Inc., displayed with permission. Tentang Kami | Redaksi | Pedoman Media Siber | Karir | Disclaimer",4
Kekurangan Pasokan Chip PS5 Bakal Diprediksi hingga 2023 : Okezone techno,"Kekurangan Pasokan Chip PS5 Bakal Diprediksi hingga 2023 Intan Rakhmayanti Dewi, Jurnalis · Senin 13 September 2021 07:47 WIB PS5 (Foto: Business insider) BUKAN rahasia jika kekurangan pasokan chip membuat produksi PlayStation 5 (PS5) dan Xbox Series X terhambat. Namun, rupanya langkanya chip ini belum akan membaik. Menurut laporan Bloomberg, perusahaan elektronik Toshiba menyatakan bahwa kondisi ini belum akan membaik hingga 2023. Mereka mengatakan bahwa chip pengatur dayanya yang digunakan oleh konsol game baru, sedang dan akan terus kekurangan pasokan di masa mendatang. “Pasokan chip akan tetap kurang hingga setidaknya September tahun depan,” ujar Takeshi Kamebuchi, direktur yang bertanggung jawab atas semikonduktor di salah satu unit Toshiba, dikutip dari Tomsguide, Minggu (12/9/2021). “Dalam beberapa kasus, kami mungkin menemukan beberapa pelanggan tidak terlayani sepenuhnya hingga 2023.” sambungnya. Ia menyebut, bahwa ini bukan hanya masalah untuk konsol seperti Xbox Series X dan PS5 saja. Kekurangan chip juga berdampak pada elektronik dan mobile konsumen lainnya. ""Pembuat konsol game adalah salah satu pelanggan yang mengajukan tuntutan terkuat dan saya dengan tulus meminta maaf atas frustrasi mereka karena tidak ada dari mereka yang memiliki kepuasan 100%, ""kata Kamebuchi. Lihat juga: Andin dan Aldebaran Serasi Pakai Baju Couple di Ikatan Cinta, Netizen Auto Bahagia #Kurangnya Pasokan Chip PS5 #Kekurangan Pasokan Chip PS5 Rolex - Jual Jam Tangan Terbaru di Indonesia Perayaan Rolex yang menggugah. Diskon 90% untuk semua jam tangan replika Ini Analisis LAPAN soal Penyebab Hujan Badai di Depok : Okezone techno Tak Perlu Laser jika Mata Mulai Kabur! Ternyata Cukup Lakukan Ini Diabetes Hilang Selamanya! Lakukan Ini sebelum Tidur Cara Membuat Soal di Google Form, Simak Yuk! : Okezone techno Tips Terhindar dari Doxing di Media Sosial Baru Ketahuan! Malware GriftHorse Sudah Menginfeksi 10 Juta Ponsel Android di 70 Negara Belum 16 Tahun Tak Boleh Lakukan Live Streaming di China Gunakan Trik Rahasia Ini dan Raih Kemenanganmu Menjadi Juara Kiko Run Competition! Game Alchemy Stars Berbahasa Indonesia Resmi Diluncurkan Free Fire Max Sudah Bisa Diklaim, Ini Cara Registrasinya Cari Berita Lain Di Sini Hati-Hati Download Film di Internet, James Bond No Time to Die Ternyata Mengandung Trojan Inilah Empat Tantangan Transformasi Digital di Indonesia Free Fire Max Sudah Bisa Diklaim, Ini Cara Registrasinya Pemerintah Nigeria Melunak, Mulai Pertimbangkan Buka Blokir Twitter Belum 16 Tahun Tak Boleh Lakukan Live Streaming di China 8 Cara Menghemat Baterai Handphone saat Digunakan Gunakan Trik Rahasia Ini dan Raih Kemenanganmu Menjadi Juara Kiko Run Competition! Clubhouse Hadirkan Fitur Putar Ulang Obrolan dan Unduh Klip Pendek Cara Cek Nomor Telkomsel Menkominfo Sebut Jurnalis Berperan Penting Lawan Hoaks © 2007 - 2021 OKEZONE.COM, About Us Redaksi Kotak Pos Karier Info Iklan Disclaimer",4
"Apple odporne na braki chipów , Samsung i OnePlus w tarapatach","wpisz tytuł szukanej gry ... WIADOMOŚĆ SPRZĘT I SOFT 26 sierpnia 2021, 10:59 Braki w dostawach chipów dotykają wszystkich, oprócz jednej firmy Deficyt chipów wciąż trwa i nic nie wskazuje na to, że ta sytuacja szybko się skończy. Apple jak się zdaje na razie jest odporne na problemy. Optymistyczne prognozy branżowych analityków zakładają, że obecny deficyt chipów zostanie uregulowany w nadchodzących miesiącach. Odmienne informacje spływają za to od sprzedawców detalicznych i hurtowych dystrybutorów – zakładają oni, że ze względu na niemalejący popyt problem będzie się pogłębiał. Siła negocjacyjna Apple w kontraktach z producentami chipów zapewniła mu stały łańcuch dostaw. Dzięki temu kalifornijska firma nie odczuła wpływu niedoboru półprzewodników w takim stopniu jak konkurencyjny Samsung. Trwający obecnie kryzys, spowodowany m.in. pandemią koronawirusa, odczuwalny jest głównie w krajach, gdzie wytwarza się podzespoły komputerowe. Wietnam i Malezja nie odzyskają za szybko pełnej mocy przerobowej, skoro rządy tych krajów próbują jednocześnie chronić swoich obywateli oraz zapobiegać zapaści lokalnej gospodarki. W najbardziej optymistycznym scenariuszu rynek ustabilizuje się w trzecim kwartale 2021 roku, w najgorszym dopiero w przyszłym roku. Wpływ pandemii na produkcję półprzewodników w Wietnamie. Źródło: www.technavio.com. Apple w kwietniu tego roku ostrzegało, że nie będzie w stanie wyprodukować wystarczającej liczby iPadów i MacBooków, aby zaspokoić zapotrzebowanie. Przedsiębiorstwo nie wytworzyło odpowiedniej ilości chipów M1 (System on Chip w architekturze ARM), montowanych w jego komputerach. Oprócz tego był problem z podażą sterowników ekranu i kontrolerów pamięci NAND. Według badania Wave7, zauważonego przez PCMag, braki krzemu zaczęły uderzać w produkcję niskobudżetowych telefonów z Androidem, zaś firmy takie jak OnePlus czy Samsung odnotowały największe „wąskie gardło” w łańcuchu zaopatrzenia. Z drugiej strony Apple zdołało przetrwać burzę, zapewniając sobie dostawę komponentów z wyprzedzeniem. Dzięki temu zakup iPhone'a 12 jest stosunkowo łatwy. Architektura chipu M1. Źródło: www.apple.com. Problemy mogły zacząć się już w marcu, kiedy Qualcomm zasygnalizował kłopoty z wytwarzaniem nisko- i średniobudżetowych chipów Snapdragon. Prezes Xiaomi – Wang Xiang – ostrzegł również, że zaopatrzenie wysokobudżetowych podzespołów też jest ograniczone. Z tego powodu korporacja będzie zmuszona podnieść koszty produkcji, jeżeli nie znajdzie sposobu na zoptymalizowanie procesu projektowania telefonów. Nam jako konsumentom pozostaje tylko czekać na ustabilizowanie się sytuacji i spokojnie patrzeć w przyszłość. Wszak wielkimi krokami zbliża się nie tylko premiera iPhone’ów 13, ale też m.in. kolejne iteracje składanych smartfonów Samsunga. Samsung może zdalnie zablokować nasz telewizor Xiaomi w drodze na smartfonowy tron - do pokonania tylko Samsung Zapraszamy Was na nasz kanał na YouTube – GRYOnline Technologie, który jest poświęcony zagadnieniom związanym z nowymi technologiami. Znajdziecie tam liczne porady dotyczące problemów z komputerami, konsolami, smartfonami i sprzętem dla graczy. sprzęt i softApple iOS iOS Fragile Existence to ambitny kosmiczny RTS dla fanów Battlestar Galactica PC to tylko 14% rynku gier w Europie; FIFA 21 najlepiej sprzedającą się grą UE może zmusić Apple do stosowania USB-C w iPhone'ach od 2024 roku [Aktualizacja] GRG, 24 września 2021, 08:56 Unia Europejska może wkrótce wymusić na Apple wprowadzenie USB-C w iPhone'ach. Jutro zostanie przedstawiony projekt przepisów dotyczący jednolitej ładowarki. Smartfony Xiaomi na celowniku rządu Litwy przez problemy z prywatnością Maycuzai, 23 września 2021, 17:00 Litewski rząd nawołuje swoich obywateli do porzucenia smartfonów Xiaomi. Ma to związek z nowym raportem, według którego chiński producent rzekomo umieścił w swoich urządzeniach moduł odpowiedzialny za cenzurę niektórych treści. iOS 15 - znamy nowe funkcje i prawdopodobną datę premiery Eklerek, 20 września 2021, 10:16 Na konferencji WWDC 2021 Apple zaprezentowało nowy system iOS 15, który wprowadza sporo drobnych zmian i nowości przydatnych w codziennym użytkowaniu. Te najciekawsze będą jednak niedostępne w Polsce. Nie Pon Wto Śro Czw Pią Sob         Najnowsze w dziale Technologie Zmiany w Chrome mogą ograniczyć ad blockery Idealna klawiatura dla studentów i drony, które chyba nie zrobią nam krzywdy Gdzie pada deszcz? Na to pytanie odpowie wkrótce AI 12 godzin przed komputerem i kłopoty ze snem - badania pokazują, jak żyją dziś nastolatki Czy zwykły gracz może zarobić na kopaniu kryptowalut? Phil Spencer przewiduje dalsze problemy z dostawami konsol w 2022 roku Google najpopularniejszą frazą w wyszukiwarce Bing Codziennie newsy o grach Popularne w dziale Technologie Asystent Google nas podsłuchuje? Zrobiłem tygodniowy eksperyment Nowy trojan kradnie dane do kont Steam i Epic Games Store Google Chrome 94 wprowadza kontrowersyjne wykrywanie bezczynności Elementarna wiedza o komputerach zamiera - młodzi nie wiedzą, czym są foldery i pliki Karty graficzne GeForce i Radeon znów drożeją 12 aplikacji na Androida i iOS-a, których nie znasz, a ułatwią ci życie",9
"Security Concerns Over Chip Shortage Are Pushing Governments to Act , Moody Says","LOCAL WEATHER INVESTIGATIONS BAQUERO VIDEO TV LISTINGS COVID-19 Vaccine Mandate Merck SCOTUS Brett Kavanaugh Gabby Petito Brian Laundrie NBCLX Breast Cancer Awareness Month Security Concerns Over Chip Shortage Are Pushing Governments to Act, Moody's Says By Saheli Roy Choudhury, CNBC • Published August 3, 2021 • Updated on August 4, 2021 at 10:07 am Adam Glanzman | Bloomberg | Getty Images A wafer is processed in a single wafer diffusion mechanism inside the GlobalFoundries semiconductor manufacturing facility in Malta, New York on March 16, 2021. More countries are pushing to produce their own semiconductor chips, which are in short supply globally, because ""it's a matter of national security,"" according to Timothy Uy from Moody's Analytics. Memory chips are crucial for making a wide range of products. They are in smartphones, gaming consoles like PlayStation 5s, household appliances like fridges and washing machines, alarm clocks, and even cars. Some reports say the chip shortage may last until 2023. More countries are pushing to produce their own semiconductor chips, which are in short supply globally, because ""it's a matter of national security,"" said an analyst at Moody's. Memory chips are crucial for making a wide range of products. They're in smartphones, gaming consoles like PlayStation 5, household appliances like fridges and washing machines, alarm clocks, and even cars. They are also used in data centers, which are full of computer servers. Op-Ed: Biden Needs to Act Now to Shore Up Economic Foreign Policy to Restore Confidence in U.S. Leadership Tesla Delivered 241,300 Vehicles in the Third Quarter, Topping Expectations ""I think the main problem really is that new supply is hard to come by and the surge in demand is not going to be abating anytime soon,"" Timothy Uy, an associate director at Moody's Analytics, told CNBC's ""Squawk Box Asia"" on Monday. ""On both the supply and demand sides, I think companies are adjusting. Governments are also getting in on the action because they view this as, in some sense, kind of a matter of national security,"" he added. Semiconductor chips are ubiquitous — without them, a lot of products will not work. This is already being felt by the auto industry, where carmakers have been forced to stall production as a result of the global chip shortage. Some reports say the chip shortage may last until 2023. Why there's a global chip shortage Manufacturing semiconductor chips is an intricate, capital-intensive process that involves weeks of production, Uy said last week in a note. It takes even longer time to distribute them, he said. He explained that new supply cannot be created instantly — and sometimes, it may take years for new supply to come online as factories need to be built and fitted with the proper technology. The capital-intensive nature of semiconductors also concentrates manufacturing into the hands of a few companies, and the barriers to entry for new companies rise with new generations of chips. The production process for each generation of semiconductor chips is different. Newer chips have bigger margins— that gives the major manufacturers more incentives to invest in their production instead of diverting resources to increase capacity for older generation chips, Uy said. That's partly why the auto industry is struggling, he explained. Cars require thousands of predominantly older-generation chips compared to smartphones and other gadgets that need a handful of newer ones. Still, Uy told CNBC there is a lot of new supply coming online as the biggest chipmakers — like Taiwan Semiconductor Manufacturing Company, Samsung Electronics, and UMC — are investing capital to build new plants. What countries are doing to boost chip supplies Governments have committed to capital spending and are pursuing policies to increase chip-making capacities as well as create local supply chains that can circumvent bottlenecks. South Korea, for example, has announced a program worth about $450 billion until 2030 that includes corporate investments. It has also beefed-up tax benefits to make its chipmakers more competitive. China has set up multibillion dollar national funds to invest in local chipmakers as it aims to catch up with the likes of the U.S., South Korea and Taiwan. The United States passed a tech and manufacturing bill that includes $52 billion to fund semiconductor research, design and manufacturing initiatives. The European Union is also prepared to commit significant funds to expand the EU's semiconductor manufacturing. Government involvement could help level the playing field and alleviate some of the shortage pressure — especially the price of memory chips, since only a handful of global companies dominate the supply chain, Uy told CNBC. Once governments are ""essentially subsidizing and providing a lot of indirect support as well to local, smaller enterprises to get in on the manufacturing of lower-end chips, that basically increases the supply,"" he said, adding it could fill the supply shortage for automakers. Correction: An earlier version gave an erroneous transcription of a quote by Moody's Timothy Uy. He said ""demand is not going to be abating anytime soon."" Zymergen plunges 68% after company says revenue will be 'immaterial' in 2022 A 'roaring era' for concerts and live events is coming, says Live Nation CEO Lyft revenue grows 125% from last year Subscribe to the CNBC YouTube Channel Copyright CNBCs - CNBC This article tagged under: TECHNOLOGYCONSUMER TECHNOLOGYENTERPRISELAW AND REGULATIONREGULATIONS NY Man Arrested After Inquiry Into Forged Vaccination Card More Breakthrough COVID Cases Close ‘Aladdin' on Broadway New Bodycam Video Sheds Light on Gabby Petito, Brian Laundrie Fight Days Before She Died Is Brian Laundrie Alive? One Seasoned Pro Says Yes — and Where He Thinks FBI Should Look Next Faire Thee Well: Celebrating 44 Years Of The New York Renaissance Faire Promoted By The New York Renaissance Faire Subscribe to our Newsletters Sign up to receive breaking news alerts in your inbox. SUBMIT TRI-STATE NEWS TIPS CONNECT WITH NBC NETWORK Do Not Sell My Personal Information Send Feedback to WNBC WNBC Public Inspection File",3
Mercedes Benz Indonesia Mulai Terdampak Kelangkaan Chip,"REPUBLIKA.ID REPUBLIKA TV GERAI IHRAM REPJABAR REPJOGJA RETIZEN BUKU REPUBLIKA Sunday, 26 Safar 1443 / 03 October 2021 Home > Oto Tek > Otomotif Mercedes Benz Indonesia Mulai Terdampak Kelangkaan Chip Kamis 22 Jul 2021 21:56 WIB Rep: Eric Iskandarsjah Z/ Red: Dwi Murdaningsih Mercedes Benz New GLE 450 4Matic Coupe. Foto: Republika/Eric Iskandarsjah Z Produk CBU mengalami keterlambatan tiga hingga empat bulan. REPUBLIKA.CO.ID, JAKARTA -- Pandemi membuat kebutuhan chip untuk pasar otomotif global terganggu. Sejak tahun lalu, para produsen chip atau semikonduckor kuwalahan untuk memenuhi kebutuhan chip bagi sejumlah perusahaan elektronik. Tapi, sepanjang 2020, kondisi itu tak mempengaruhi pasokan kendaraan di Indonesia. Hanya saja, karena kelangkaan itu masih terjadi, PT Mercedes Benz Distribution Indonesia (MBDI) mengungkap bahwa kelangkaan chip mulai mempengaruhi pasokan mobil untuk pasar tanah air. Deputy Director Sales Operation and Porduct Management MBDI, Karyanto Hardjosoemarto mengatakan, kondisi itu hanya mempengaruhi beberapa jenis produk saja. ""Produk yang paling terpengaruh adalah produk yang diimpor secara complete built up (CBU), kata Karyanto dalam Meet Mercedes Chat pada Kamis (22/7). Kondisi itu pun membuat beberapa produk CBU mengalami keterlambatan pasokan sekitar tiga hingga empat bulan. MBDI pun terus melakukan koordinasi dengan kantor pusat Mercedes Benz untuk selalu melakukan monitoring sehingga kebutuhan produk itu dapat selalu dipenuhi dengan baik. ""Mayoritas produk yang mengalami keterlambatan adalah niche model atau model yang dipesan khusus oleh konsumen.  Sehingga, total volume yang mengalami keterlambatan jumlahnya tidak signifikan,"" ucapnya. Ia juga menekankan, kelangkaan chip sama sekali tidak berpengaruh terhadap produk complete knock down (CKD). Artinya, hingga saat ini, pasokan untuk produk yang dirakit di Wanaherang, Bogor masih dapat dipenuhi sesuai dengan kebutuhan yang ada. Di satu sisi, agar kelangkaan chip ini dapat diselesaikan, saat ini sejumlah produsen chip terus dikebut agar dapat mengingkatkan kapasitas produksi. Dikutip dari ET CIO, salah satu produsen chip terbesar, Taiwan Semiconductor Manufacturing Company (TSMC) pun telah menggelontorkan sejumlah modal tambahan demi dapat meningkatkan kapasitas produksi. Total, TSMC menyiapkan modal tambahan sebesar 6 miliar dolar AS untuk meningkatkan kapasitas produksi pada 2021 dan tahun depan. Dengan begitu, TSMC mampu memenuhi kebutuhan chip secara merata baik untuk industri otomotif dan sejumlah produsen elektronik seperti Apple, Qualcomm dan Nvidia. Yuk koleksi buku bacaan berkualitas dari buku republika ... industri otomotif terdampak pandemi Solo Siapkan 2 Tempat Isolasi Terpusat Pasien Gejala Ringan Testing Kembali Digenjot, Kasus Harian Covid-19 Naik Lagi Warga Uganda Bayar untuk Vaksin Covid-19 tapi Disuntik Air Warga Bandarlampung Keluhkan Sulit Dapat Vaksin Covid-19         Dapatkan Update Berita Republika Rangkaian Pembukaan Pekan Olahraga Nasional XX Papua (2) PON XX: Siapa Dampingi Tim Sepak Bola Papua ke 6 besar? Rangkaian Pembukaan Pekan Olahraga Nasional XX Papua (1) Mantan Atlet: PON Papua Berdampak Baik Bagi Indonesia Timur Live; Barcelona Kembali Telan Kekalahan Setelah dibantai Benfica beberapa hari lalu, kini Barca ditekuk Atletico Madrid. Unsiq Rintis Kampung Laboratorium Kreatif Berbasis Limbah Kampung laboratorium ini akan menjadi ruang belajar terbuka untuk mengolah limbah. 48 Atlet Aeromodeling Berebut Medali di PON XX Papua Cabor ini diikuti oleh 12 provinsi. Live; Menang Tipis Kontra Sassuolo, Inter Tempel Napoli Kini Inter hanya tertinggal satu poin. Kasoem Vision Care Kedepankan Kelengkapan Tes Mata Pemeriksaan ini, kata dia, tidak memiliki batasan usia. Menparekraf Sambangi Desa Wisata Cikolelet, Serang Diabetes hilang selamanya & pankreas kembali sehat! 100% alami Tak Perlu Laser jika Mata Mulai Kabur! Ternyata Cukup Lakukan Ini Kelangkaan  Chip Mulai Pengaruhi Produksi Honda di Indonesia Wuling Bakti Pendidikan Gandeng SMK Taruna Bangsa Cara memulihkan penglihatan hingga 126% di rumah Anda wajib minum ini! Agar tensi 120/80 dan pembuluh darah bersih GIIAS Batal, Inilah Konsep Pameran Baru Gaikindo Auto2000 Donasi 23 Ribu Paket Sembako ke Warga Terdampak Glukoma, Mata Kabur hingga Katarak Bisa Anda Hilangkan dengan Ini Gadis ini hasilkan 12 miliar rupiah dalam 28 hari dengan cara ini Kelangkaan Chip Bikin Konsumen Mercedes Benz Inden Setahun Ornamen Arab di Masjid Terbesar Xining Dilaporkan Dilucuti  Kisah Sukses Batik Ruzza Pekalongan Tembus Pasar Ekspor Ahad , 03 Oct 2021, 00:09 WIB Solskjaer Yakin Strateginya Sudah Tepat Pembangunan Masjid 1001 Kubah di Sambas Banjir Dukungan Diimbangi Persib, Milo: PSM Hanya Kurang Beruntung In Picture: Persija Bekap Persiaraja 1-0 di Stadion Pakansari Bogor Bhayangkara FC Ingin Sapu Bersih Seri Pertama Jokowi Resmikan Gedung Papua Muda Inspiratif Sabtu , 02 Oct 2021, 19:32 WIB Tips Menjaga Kesehatan Jantung Saat Pandemi Waspada Cuaca Buruk di Peralihan Musim Jl. Warung Buncit Raya No 37 Jakarta Selatan 12510 ext 308 Phone: 021 780 3747 Fax: 021 799 7903 ABOUT US DISCLAIMER PRIVACY POLICY PEDOMAN SIBER PETA SITUS",4
