Title,News,Topic
Kelangkaan Chip Malah Menguntungkan Brand Premium,"Kelangkaan Chip Malah Menguntungkan Brand Premium Kelangkaan chip membuat pasokan mobil tertentu terhambat dan harga naik. Selasa , 14 Sep 2021, 13:01 WIB Rep: Eric Iskandarsjah Z Red: Dwi Murdaningsih REPUBLIKA.CO.ID, MUNICH -- Pada segmen kendaraan mewah, konsumen cenderung rela membayar lebih demi segera memperoleh mobil impianya. Hal ini pun terjadi pada sejumlah konsumen BMW dan Mercedes Benz. Dikutip dari Irish Times pada Selasa (14/9), fenomena tersebut juga terjadi selama adanya kelangkaan chip atau semikonduktor. Karena, kelangkaan tersebut membuat pasokan mobil tertentu mengalami hambatan. Kondisi ini pun membuat konsumen harus menunggu mobil impianya selama beberapa bulan. Tapi, bagi yang berkantong tebal dan membutuhkan mobil dengan segera, maka konsumen tersebut akan rela membayar lebih agar mobil impiannya segera dikirimkan. Otomatis, hal ini membuat harga pasar untuk produk premium jadi terdongkrak. Artinya, kelangkaan ini justru memberikan keuntungan tersendiri bagi sejumlah brand tertentu. Kondisi ini pun membuka peluang bagi babak baru dalam industri mobil mewah. Dengan kondisi ini, maka brand mobil premium bisa mematok harga baru yang lebih tinggi dan lebih leluasa dalam meningkatkan kemewahan dalam produk yang dipasarkan. Chief Financial Officer Daimler, Harald Wilhelm mengatakan, agar kenaikan harga ini tetap terjaga, maka pasokan kendaraan akan tetap dibatasi meski kelangkaan chip telah reda. ""Di satu sisi, kami akan meningkatkan kemewahan pada produk kami,"" kata Harald. Hal senada pun diamini oleh BMW. Chief Financial Officer BMW, Nicolas Peter mengatakan, BMW telah melihat adanya peningkatan kekuatan harga selama 24 bulan terakhir. ""Hal ini mendorong kami untuk terus melakukan pengelolaan pasokan untuk bisa mempertahankan level harga yang tercapai saat ini,"" kata Nicolas Peter. Tips Melibas Tanjakan dengan Mobil FWD Perlukah Memanaskan Mobil-Mobil Keluaran Terbaru? Risiko Tangki Mobil Hampir Kosong, Ini Penjelasannya kelangkaan chip industri otomotif terdampak kelangkaan chip mobil mewah naik harga harga mobil mewah naik bmw BACA JUGA: Update Berita-Berita Politik Perspektif Republika.co.id, Klik di Sini Ahad , 03 Oct 2021, 00:09 WIB - ekonomi Kisah Sukses Batik Ruzza Pekalongan Tembus Pasar Ekspor Ahad , 03 Oct 2021, 00:15 WIB - sepakbola Bhayangkara FC Ingin Sapu Bersih Seri Pertama Ahad , 03 Oct 2021, 00:13 WIB - inpicture In Picture: Persija Bekap Persiaraja 1-0 di Stadion Pakansari Bogor Ahad , 03 Oct 2021, 00:25 WIB - dunia-islam Pembangunan Masjid 1001 Kubah di Sambas Banjir Dukungan Ahad , 03 Oct 2021, 01:01 WIB - sepakbola Solskjaer Yakin Strateginya Sudah Tepat Ahad , 03 Oct 2021, 00:40 WIB - inpicture In Picture: Menparekraf Sambangi Desa Wisata Cikolelet, Serang Ahad , 03 Oct 2021, 00:35 WIB - inpicture In Picture: Pengrajin Cenderamata Suvenir PON XX Papua Ahad , 03 Oct 2021, 00:19 WIB - sepakbola Persik Sudah Lupakan Pertemuan Vs PSS di Piala Menpora Ahad , 03 Oct 2021, 00:36 WIB - inpicture In Picture: Pengrajin Batik Kediri Berpromosi di Pusat Perbelanjaan Ahad , 03 Oct 2021, 00:13 WIB - sepakbola Eduardo Almeida Sebut Arema Targetkan 3 Poin Vs Persela",4
تراجع مبيعات السيارات في أوروبا بسبب أزمة نقص الرقائق,"الأحد, 3 أُكْتوبِر 2021 | 25 صَفَر 1443 «نجم لخدمات التأمين» تعزز دور قطاع التأمين لتحقيق مستهدفات رؤية المملكة 2030 تراجع مبيعات السيارات في أوروبا بسبب أزمة نقص الرقائق تراجع مبيعات السيارات في أوروبا بسبب أزمة نقص الرقائق الخميس 16 سبتمبر 2021 بعد شهور من الارتفاع المطرد، تتراجع مبيعات السيارات في أوروبا حاليا في ظل تداعيات أزمة نقص إمدادات الرقائق الإلكترونية المستخدمة في صناعة السيارات. وبحسب بيانات اتحاد مصنعي السيارات الأوروبي الصادرة اليوم الخميس تراجعت مبيعات السيارات الجديدة خلال أغسطس الماضي بنسبة 18%  سنويا بعد تراجعها خلال يوليو الماضي بنسبة 24%. في الوقت نفسه فإن المبيعات خلال الأشهر الثمانية الأولى من العام الحالي زادت بنسبة 13% فقط مقارنة بالعام الماضي، وهو ما يمثل أقل من نصف نسبة الزيادة التي تم تسجيلها خلال النصف الأول من العام الحالي، بحسب وكالة بلومبرج للأنباء. ويعاني إنتاج السيارات في أوروبا وباقي مناطق العالم من أزمة نقص إمدادات الرقائق مما أجبر العديد من الشركات الكبرى إلى وقف أو تقليص عدد ساعات العمل في الكثير من مصانعها. في الوقت نفسه أكد مسؤولو شركات مثل بي.إم,دبليو وفولكس فاجن ودايملر أن أزمة الرقائق ستستمر خلال العام المقبل وربما إلى ما بعد ذلك. وأشارت وكالة بلومبرج إلى أن شركات السيارات تتجه نحو التركيز على إنتاج السيارات عالية السعر ذات الربحية الأكبر في ظل نقص إمدادات الرقائق بهدف تحقيق أعلى معدل للتدفقات النقدية خلال هذه الفترة. وبحسب بيانات اتحاد مصنعي السيارات  تراجعت المبيعات في إسبانيا خلال الشهر الماضي  بنسبة 29% سنويا وفي إيطاليا بنسبة 27%. صندوق المعاشات الياباني يسجل عائدا ""تاريخيا"" بـ 339 مليار دولار في 12 شهر ارتفاع أسعار الشحن البحري إلى مستويات قياسية.. عجز في السفن والحاويات الفارغة أمريكا مهددة بنضوب الأموال وتخلف عن دفع الدين خلال أيام.. انفجار مالي عالمي ملياردير هندي يخسر 13 مليار دولار في 4 أيام 5.4 تريليون دولار ادخار المستهلكين منذ بدء الجائحة.. تعادل 6 % من الناتج الإجمالي العالمي ""بيتكوين"" تهبط 8% مع اتجاهها إلى تكبد أكبر خسارة شهرية الليرة التركية تتراجع إلى أدنى مستوى لها على الإطلاق عند 8.6 مقابل الدولار المزيد من أخبار اقتصادية- عالمية بايدن يتعهد بإقناع الأمريكيين ببرنامجه الاقتصادي   تعهد الرئيس الأمريكي جو بايدن اليوم بلقاء مواطنيه في أنحاء البلاد للدفاع عن برنامجه الاقتصادي، مشددا على أنه معتدل في محاولة لحشد بعض نواب حزبه الوسطيين الذين يعرقلون تبنيه. الهند تطلب من شركتين للطاقة الكهرومائية تقديم عطاءات لمشاريع الطاقة المتجددة طلبت الهند من شركتين حكوميتين للطاقة الكهرومائية التقدم بعطاءات لإقامة مشروعات للطاقة الشمسية وطاقة الرياح، حيث تسعى البلاد إلى تعزيز قدراتها من مصادر الطاقة المتجددة وتخليص اقتصادها من الانبعاثات الكربونية. انضم إلى النشرة الإلكترونية احصل على النشرة الإلكترونية وتابع أهم المستجدات",9
Blow for PS5 and Nintendo Switch production as consoles hit by chip shortage,"Blow for PS5 and Nintendo Switch production as consoles hit by chip shortage The shortage could affect production of the popular new console until 2023, putting even more pressure on the already stretched PS5 demand which has already been plagued by supply problems 16:46, 4 SEP 2021UPDATED16:47, 4 SEP 2021 The chips are used to regulate power supply(Image: Getty Images) Computing giant Toshiba has issued a warning that it may not be able to meet demand for chips until 2023 – putting PS5 production in peril. The supply issue will affect several big names which use the chips, including those who manufacture next-gen consoles such as the PS5 and Nintendo Switch. Gamers looking to purchase Sony's latest console in the PS5 have already faced a deluge of problems, including supply simply not being able to meet demand, as well as issues with bots buying out stock to be sold at extortionate rates on sites like eBay. The chips in question regulate the power supply, which are used in almost any electronic device more complicated than a hairdryer. The Playstation 5 is one of the products severely affected by the shortage Joe Biden tells FBI to release files on 9/11 investigation – and possible Saudi links Bouncer sucker punches dad in horrifying CCTV and leaves him in coma They are so commonly used that in the past they have been treated less like a component and more like a commodity. In another blow for gamers eager to get hold of a next-gen console, it is video game console manufacturers who are particularly badly hit by the shortage. Even production of the previous generation console the PS4 has been affected by the shortage. Takeshi Kamebuchi, a director at Toshiba who specialises in semi-conductor production, told thegamer.com: ""The supply of chips will remain very tight until at least September next year. The Nintendo Switch has also been badly hit by the shortage(Image: Future Publishing) “In some cases, we may find some customers not being fully served until 2023. “Game console makers are among the customers making the strongest demands and I’m sincerely sorry for their frustration as none of them have a 100% satisfaction."" The problem is even urgent enough to warrant intervention from the highest office, with US President Joe Biden issuing an executive order earlier this year to increase domestic production of semiconductors in the USA. Power chips have become so sought after that Hong Kong truck drivers have even taken to smuggling them over drugs, as the chips are worth more. To stay up to date with all the latest news, make sure you sign up to one of our newsletters here. Outrage as wrestling star MJF asks ‘is it too late to abort?’ in reply to snap of fan Parkland school shooter who slaughtered 17 people can't be called an 'animal' at trial",1
عمالقة التكنولوجيا يسعون لإنتاج « رقائق إلكترونية » دون الاعتماد على الشركات,"السبت 02 أكتوبر 2021 رئيس مجلسى الإدارة والتحرير عمالقة التكنولوجيا يسعون لإنتاج «رقائق إلكترونية» دون الاعتماد على الشركات الثلاثاء 07/سبتمبر/2021 - 03:47 م يسعى عمالقة التكنولوجيا لتطوير رقائق إلكترونية داخليًا بدلًا من الاعتماد على الشركات الحالية، في محاولة للحد من الأزمة العالمية الحالية في تصنيع تلك الرقائق، ما أثر بالسلب على عدة صناعات. وذكر تقرير لشبكة ""سي إن بي سي"" الأمريكية، أن شركات آبل وأمازون وفيسبوك وتسلا وبايدو، تتجنب شركات الرقائق القائمة وتجلب جوانب معينة من تطوير الرقائق داخليًا.. ووفقًا للشبكة الأمريكية يندفع عمالقة التكنولوجيا لتطوير رقائقهم الخاصة. ونقلت الشبكة عن مسئول تقني قوله ""إن على نحو متزايد، تريد هذه الشركات رقائق مصنوعة خصيصًا لتلائم المتطلبات المحددة لتطبيقاتها بدلًا من استخدام نفس الرقائق العامة مثل منافسيها، ما يمنحهم مزيدًا من التحكم في تكامل البرامج والأجهزة بينما يميزهم عن منافسيهم"". وعلى جانب آخر، حذر تقرير من أن النقص العالمي في الرقائق الإلكترونية، يمكن أن يؤثر على توريد بطاقات الائتمان والخصم المباشر.  وذكر موقع ""إن دي تي في""، اليوم الأحد، أن ما يقرب من 90% من المدفوعات غير النقدية تتم باستخدام البطاقات في المتاجر الفعلية، وهي ضرورية أيضًا للوصول إلى النقد.  كما حذر تقرير من نقص في بطاقات الائتمان- الخصم وبطاقات الدفع الأخرى، ويمكن أن يؤثر النقص في صناعة الدفع عبر الإنترنت أيضًا، مرجحًا استمرار النقص العالمي في الرقائق حتى عام 2022.  هذا وحذرت جمعية الدفع الذكي في تقريرها من أن النقص العالمي في الرقائق الآن يهدد بإخراج نظام الدفع عبر الإنترنت عن مساره، في إشارة إلى أهمية بطاقات الدفع للحياة اليومية والتجارة، منوهة إلى خطورة الاضطرابات الكبيرة في هذا المجال إذا لم تتم معالجة المشكلة. وقالت إنه يتم إنتاج أكثر من 3 مليارات بطاقة دفع كل عام على مستوى العالم للأشخاص الذين يفتحون حسابًا مصرفيًا، أو أولئك الذين يجددونها بعد انتهاء الصلاحية أو ليتم استبدالها، لكنّ مصنعي البطاقات يواجهون صعوبات متزايدة في الحصول على الرقائق بسبب الاختناقات في سلسلة التوريد. كاليفورنيا الولايات المتحدة إنتاج رقائق إلكترونية القضاء وثورة 30 يونيو أول رد من الزمالك على قرار بطلان الدعوة للانتخابات استعلم فورا| لينك نتيجة تنسيق المرحلة الثالثة 2021 بالتفصيل قرار مفاجئ من «الشباب والرياضة» بشأن انتخابات الزمالك لينك مباشر| الاستعلام عن نتيجة تنسيق الشهادات المعادلة 2021 باعتراف صريح.. «آخر النهار» يكشف سر القبض على الشيخ محمود شعبان عبدالمجيد محمود: «الجاسوس مرسي» أصدر قرارًا بإقالتي وعدت لمنصبي بقوة القانون فى حضرة الست.. «أم كلثوم» بها تأتنس القلوب يوم القضاء.. قاضياته.. وقضاته أدعو لسحب جائزة نوبل من رئيس وزراء إثيوبيا نهاية عصر اضطهاد المرأة مصر فى إفريقيا.. من عبدالناصر إلى السيسى الفرار من القدر مقطع من رواية «كسر الخاطر» سارة شريف تكتب: تأييد مع وقف التنفيذ ندوة إلهام شاهين ضمن فعاليات مهرجان القومى للمسرح وفاة رأفت الخواجة كبير مشجعى الزمالك رئيس حماس في غزة يصل مصر غدًا.. وبحث صفقة تبادل أسرى مع إسرائيل تضم مصر والأردن.. مجموعة ميونخ تسعى لاستئناف محادثات السلام بشأن فلسطين الاحتلال الإسرائيلي يعلن اعتقال فلسطينيين تسللا من قطاع غزة مصر حوادث عالم رياضة اقتصاد فن الثقافة تحقيقات الدين لله محافظات أيام زمان تقارير ومتابعات ملفات خاصة سياسي لايف ستايل محطة تل أبيب منوعات هاشتاج توك شو فيديو صور إنفوجراف الكرازة تكنولوجيا",9
جريدة الرياض | ارتفاع أسعار السيارات في أوروبا بما يتراوح بين 3 و6 % بسبب نقص الرقائق,"السبت 25 صفر 1443هـ 2 أكتوبر 2021م GMT+3 12:22:34am ارتفاع أسعار السيارات في أوروبا بما يتراوح بين 3 و6% بسبب نقص الرقائق روما - د ب أ        أظهر تقرير صادر عن شركة التأمين على القروض إيولر هيرمس ارتفاع أسعار السيارات في أوروبا بسبب نقص المعروض نتيجة قلة إمدادات الرقائق الإلكترونية وغيرها من مستلزمات الإنتاج. ونقلت وكالة بلومبرج للأنباء عن بيان للشركة التابعة لمجموعة التأمين الألمانية العملاقة آليانز القول إن الدراسة التي أجرتها على سوق السيارات الأوروبية أظهرت أن الفجوة بين العرض والطلب في السوق ستستمر خلال 2022. وبحسب الدراسة فإن أسعار السيارات في أوروبا ستزيد بنسبة تتراوح بين 3 و6% بشكل عام. ومن المتوقع ارتفاع أسعار السيارات في ألمانيا بما يتراوح بين 4% و10% وهو ما يمثل فرصة ""فريدة"" لتعزيز هامش أرباح شركات السيارات الألمانية. يذكر أن شركات صناعة السيارات وشركات صناعة الإلكترونيات على المستوى العالمي تعاني من نقص في الرقائق، ويرجع ذلك جزئيا إلى زيادة الطلب على تكنولوجيا الكمبيوتر مع تزايد عمل الناس من المنزل بسبب تفشي جائحة كورونا. وأدى نقص إمدادات الرقائق إلى وقف تشغيل العديد من مصانع السيارات في مختلف أنحاء العالم لفترات متباينة، في الوقت الذي تحاول فيه حكومات الدول المعنية إيجاد حلول طويلة المدى لهذه الأزمة. انتهت الفترة المسموحة للتعليق على الموضوع حمل البيان التمهيدي للميزانية العامة للدولة للعام المالي المقبل 2022، بشائر خير للوطن والمواطن، حيث انخفض العجز ...",9
بسبب نقص الرقائق .. فولكس فاجن تقلص إنتاج أكبر مصانعها,"الأحد, 3 أُكْتوبِر 2021 | 25 صَفَر 1443 شركة بيت التأمين .. منظور آخر للوساطة بسبب نقص الرقائق .. فولكس فاجن تقلص إنتاج أكبر مصانعها  بسبب نقص الرقائق .. فولكس فاجن تقلص إنتاج أكبر مصانعها  الجمعة 20 أغسطس 2021 تعتزم عملاقة صناعة السيارات الألمانية فولكس فاجن  تقليص الإنتاج في أكبر مصنع تابع لها بسبب نقص إمدادات الرقائق الإلكترونية المستخدمة في صناعة السيارات. وذكرت أكبر منتج للسيارات في أوروبا في بيان اليوم إن مصنعها بمدينة فولفسبورج الألمانية، وهو أكبر مصنع في العالم من حيث عدد العاملين به، 60 ألف عامل تقريبا، سيعمل لفترة واحدة يوميا من يوم الإثنين إلى يوم الجمعة المقبلين بسبب نقص الرقائق. كما ستمدد شركة أودي للسيارات الفارهة والتابعة لمجموعة فولكس فاجن الأجازة الصيفية لعمال اثنين من مصانعها في ألمانيا  لمدة أسبوع  إضافي بسبب نقص الرقائق. وأشارت بلومبرج إلى أن شركات صناعة السيارات في العالم حذرت من شهور صعبة مقبلة بسبب تفشي السلالة دلتا المتحورة الجديدة من فيروس كورونا المستجد في العديد من دول جنوب شرق آسيا مما أدى إلى نقص إمدادات الرقائق المستخدمة في صناعة السيارات. كانت صحيفة نيكي الاقتصادية اليابانية ذكرت أمس أن تويوتا كورب اليابانية، أكبر منتج للسيارات في العالم، تعتزم إنتاج نحو 900 ألف سيارة فقط الشهر المقبل  وفقا لتوقعات يوليو  الماضي وهو ما يقل بمقدار 500 ألف سيارة تقريبا عن متوسط إنتاجها الشهري بسبب نقص إمدادات الرقائق. وكان متحدث باسم وحدة التصنيع التابعة لشركة تويوتا في أدابازاري شمال غربي تركيا قال في وقت سابق من الأسبوع الحالي إنه سيتم تعليق الإنتاج لأسبوعين بسبب النقص في أشباه الموصلات، مضيفا أن الإنتاج سيتوقف بين العشرين من أغسطس الجاري والخامس من سبتمبر القادم. الخطوط الجوية الفلبينية تتقدم بطلب لإشهار إفلاسها  الخميس المقبل إدراج وتداول أسهم الشركة العربية لخدمات الإنترنت والاتصالات ""سلوشنز"" قتيلان في حادث سيارة ""تيسلا"" من دون سائق إصابات كورونا تواصل الانخفاض في السعودية.. تسجيل 42 حالة تعريفة الاستهلاك الكثيف للكهرباء للمنشآت على فئتين.. حسب تكاليف المواد الخام الحكم على ""جونسون أند جونسون"" بدفع تعويضات قي قضايا تسبب بودرة التلك بالسرطان ضغوط هائلة على ""إيفرجراند"" عملاق العقارات الصيني.. ديونها 300 مليار دولار المزيد من أخبار الشركات- عالمية نهاية منصة ""أوزي"" بعد اتهام مديريها بسوق أكاذيب لجذب المستثمرين تعتزم منصة الإعلام الأميركية ""أوزي"" وقف أنشطتها نهائيا بعد معلومات عن أكاذيب ساقها مديروها بهدف استقطاب المستثمرين. ""ميرك"" تعتزم شراء ""أكسليرون"" لأدوية الأمراض النادرة مقابل 11.5 مليار دولار وافقت شركة الأدوية الأمريكية ""ميرك"" على شراء شركة أكسليرون فارما المتخصصة في تطوير أدوية للأمراض النادرة، مقابل نحو 11.5 مليار دولار، في إطار مساعي ميرك لتعزيز محفظة عقاقير الأمراض النادرة لديها. انضم إلى النشرة الإلكترونية احصل على النشرة الإلكترونية وتابع أهم المستجدات",9
Pelaburan 20 Bilion Intel Untuk Membangunkan Kilang Pembuatan Cip Semikonduktor Dijangka Akan Disebarkan Ke Sekitar Eropah,"We are checking your browser... amanz.my Please stand by, while we are checking your browser... Why do I have to complete a CAPTCHA? Completing the CAPTCHA proves you are a human and gives you temporary access to the web property. What can I do to prevent this in the future? If you are on a personal connection, like at home, you can run an anti-virus scan on your device to make sure it is not infected with malware. If you are at an office or shared network, you can ask the network administrator to run a scan across the network looking for misconfigured or infected devices. Another way to prevent getting this page in the future is to use Privacy Pass. You may need to download version 2.0 now from the Chrome Web Store.",6
