Title,News,Topic
Directorul Daimler avertizează că producătorii auto s - ar putea confrunta cu deficitul de cipuri până în 2023,"CELE MAI NOI ȘTIRI ȘI ALERTE BREAKING NEWS: SE INCARCA... Știri din R. Moldova Directorul Daimler avertizează că producătorii auto s-ar putea confrunta cu deficitul de cipuri până în 2023 Creşterea cererii pentru semiconductori va provoca dificultăţi de aprovizionare industriei auto în 2022 şi în 2023, deşi până atunci deficitul ar putea fi mai puţin sever, a afirmat directorul general al producător auto german Daimler AG, Ola Källenius, transmite Reuters. Daimler este printre marii producători auto care au fost nevoiţi să-şi reducă producţia în 2021, din cauza crizei de cipuri pentru industria auto. ""Câţiva furnizori de semiconductori s-au referit la probleme structurale în privinţa cererii. Aceste probleme ar putea avea influenţă în 2022, dar situaţia ar putea fi mai relaxată în 2023"", le-a spus jurnaliştilor Källenius. În pofida actualului deficit, grupul german speră că în trimestrul patru se va îmbunătăţi aprovizionarea din partea propriilor săi furnizori de cipuri, potrivit Agerpres.ro. Şi directorul general al producător auto german BMW AG, Oliver Zipse, se aşteaptă ca problemele în aprovizionarea cu semiconductori să se menţină şi anul viitor. ""Mă aştept ca acest deficit general de cipuri să continue în următoarele 6 - 12 luni, dar nu văd probleme pe termen lung, industria auto fiind un client atractiv pentru producătorii de cipuri"", a declarat şeful BMW. Daimler deţine divizia de lux Mercedes-Benz şi brandul Smart. În România, Daimler are două unităţi de producţie, la Cugir şi Sebeş. TAGS: bmw ag cugir daimler ag mercedes-benz ola kallenius oliver zipse romania sebes Toronto Real Estate Prices Might Surprise You Toronto Real Estate | Search Ads Carmen Jorda's Mini Dress; Stir On Red Carpet. The Most Expensive Planes The Military Has Ever Commissioned Rare Pics Of Princess Diana That Tell Us What We Knew All Along Baking Soda Tricks Everyone Should Know About Florida Real Estate Prices Might Surprise You Florida Real Estate | Search Ads Raed Arafat: Restricțiile nu se aplică raporturilor de muncă Berlinezii au votat să-i evacueze silit pe marii proprietari de apartamente: Preţurile locuinţelor au înregistrat creşteri rapide VIDEO După ce Drulă a interzis-o, Dan Vîlceanu dă liber: Se construiește linia de metrou spre aeroportul din Otopeni Ministrul Energiei din Luxemburg: 'UE ar trebui să limiteze speculatorii financiari pe pieţele gazelor naturale europene' HOROSCOP 3 octombrie 2021 Loredana își ține fanii numai în șocuri! Ce s-a mai întâmplat de data asta Wow! Ce transformare, Bahmuțeanca a slăbit 20 kg în 4 luni Simptome neobișnuite ale accidentului vascular cerebral. De ce femeile sunt mai expuse riscului Jurnaliștii nu au scăpat de supărarea protestatarilor anti-restricții: ‘Mass-media este virusul’ Ultimă oră! Sub coordonarea AUR, mii de protestatari pleacă spre Cotroceni! Traseul pe care îl vor urma Hotărârea de Guvern a fost publicată în Monitorul Oficial! Doar vaccinații și cei trecuți prin boală vor putea merge la nunți și botezuri Semnal de pace din partea Jandarmeriei, după ce peste 13.000 de români au ieșit în stradă: ‘Legea nu ne permite nouă să interzicem participarea, organizatorul este responsabil’ Revine obligativitatea purtării măștii de protecție pe stradă! Anunțul lui Raed Arafat 45.000 de persoane s-au vaccinat în ultimele 24 de ore! Restricțiile din Capitală se modifică din nou! Raed Arafat anunță că doar nevaccinații vor avea de suferit Live George Simion, la protestul de la Universitate: ‘Suntem deja 10.000 de oameni! O să ne unim cu toții’ Întrevederea de rămas bun dintre Angela Merkel și Papa Francisc va avea loc la 7 octombrie Hatice Cengiz, logodnica jurnalistului Khashoggi, îl acuză de ipocrizie pe Joe Biden Viktor Orban: Europa Centrală trebuie să aibă o mai mare influenţă în elaborarea politicilor UE Lavrov consideră că alianţele SUA în regiunea Indo-Pacific subminează structurile ASEAN Taiwanul critică vehement incursiunile aeriene chineze în spaţiul său aerian Teheranul denunță recenta vizită a ministrului de externe israelian în Bahrain Georgienii votează într-un climat de tensiune după arestarea fostului preşedinte Mihail Saakaşvili Regina Elisabeta a II-a îndeamnă Parlamentul Scoţiei să lucreze împreună în pofida dezacordurilor dintre deputaţi Vasile Bănescu îi dă o lecție lui Cosmin Prelipceanu, după ce jurnalistul a cerut ca statul să-i scape pe copii de părinți DECIZIE OFICIALĂ Masca este OBLIGATORIE și în aer liber, iar cei cu test RT-PCR nu mai au beneficiile de până acum S-a anunțat RUPEREA USR de PLUS: ‘Dacă va câștiga Dacian Cioloș, mulți parlamentari o să se rupă de partid’ Școlile NU se mai închid, indiferent de cât va fi rata de infectare: Decizia luată de Guvern Armata va livra benzină începând de luni în Marea Britanie Surpriză mare în politica franceză: Marie Le Pen anunţă că ar putea susţine candidatura lui Eric Zemmour la prezidenţiale în detrimentul fiicei sale Germania include România pe lista zonelor cu risc epidemiologic ridicat - Se cer documente care atestă vaccinarea sau trecerea prin boală Primăria Municipiului Constanța a hotărât prioritizarea refacerii secțiilor non-covid ale Spitalului de Boli Infecțioase VIDEO Raed Arafat îi amenință pe patronii de HORECA cu închiderea: Șeful DSU nu își dă seama că cei care vor pierde vor fi clienții și angajații HORECA Raed Arafat: 'Măsurile adoptate de Guvern privind gestionarea pandemiei nu se aplică raporturilor de muncă' Raed Arafat: Restricțiile nu se aplică raporturilor de muncă Berlinezii au votat să-i evacueze silit pe marii proprietari de apartamente: Preţurile locuinţelor au înregistrat creşteri rapide VIDEO După ce Drulă a interzis-o, Dan Vîlceanu dă liber: Se construiește linia de metrou spre aeroportul din Otopeni Cum circuli legal noaptea prin București dacă nu te-ai vaccinat. FORMULARELE necesare, potrivit legii Jandarmii au folosit spray lacrimogen la un protest la Rădăuţi - O persoană rănită în timpul incidentelor O parte din protestatarii din Piața Victoriei au ajuns la Palatul Cotroceni - Jandarmeria a BARICADAT instituția iar protestul este PAȘNIC Sonda spaţială BepiColombo a realizat primul ei zbor în jurul planetei Mercur Ziua Filmului Spaniol, marcată la Institutul Cervantes din Bucureşti prin proiecţia lungmetrajului câştigător al primelor premii Goya O expoziţie dedicată pictorului român Dorin Coltofeanu, găzduită de o galerie de artă din oraşul bulgar Varna În Europa astăzi nu există centru sau periferie, state membre vechi sau noi, transmite Charles Michael (CE) Varianta care ar putea salva și România de explozia prețurilor la gaze - Premierul Spaniei propune achiziții la nivel de UE VIDEO INCREDIBIL Klaus Iohannis s-a dezlănțuit la adresa Uniunii Europene și a Ungariei: 'Şi pe mine mă enervează' ULTIMELE ȘTIRI CELE MAI CITITE Cum circuli legal noaptea prin București dacă nu te-ai vaccinat. FORMULARELE necesare, potrivit legii Armata va livra benzină începând de luni în Marea Britanie Jandarmii au folosit spray lacrimogen la un protest la Rădăuţi - O persoană rănită în timpul incidentelor Casa Regală a Marii Britanii cheltuie o avere cu procesul de viol al prinţului Andrew Surpriză mare în politica franceză: Marie Le Pen anunţă că ar putea susţine candidatura lui Eric Zemmour la prezidenţiale în detrimentul fiicei sale Germania include România pe lista zonelor cu risc epidemiologic ridicat - Se cer documente care atestă vaccinarea sau trecerea prin boală Arsenal a remizat cu Brighton, scor 0-0, în Premier League Protestatari DISPERSAȚI cu GAZE LACRIMOGENE la Rădăuți - Ambulanțe chemate la protestul din nordul țării Sepsi Sfântu Gheorghe – FC Rapid, scor 2-2. Oaspeţii au condus cu 2-0, în Liga I O parte din protestatarii din Piața Victoriei au ajuns la Palatul Cotroceni - Jandarmeria a BARICADAT instituția iar protestul este PAȘNIC Noi restricţii în Capitală, adoptate sâmbătă seară: Intră în vigoare de la miezul nopții / Cum circuli noaptea, când se închid magazinele, unde porți mască Guvernul reacționează dur la proteste: Un român a murit la fiecare 8 minute în ultimele 24 de ore din cauza COVID-19 Protestatari de la Guvern au pornit ÎN MARȘ către PALATUL COTROCENI - Vor să picheteze președinția în legătură cu MĂSURILE Covid și incendiul de la Constanța Torino – Juventus, scor 0-1, în Serie A Angela Merkel îşi ia rămas bun de la Papa Francisc la 7 octombrie Alegerile din Germania: O coaliţie condusă de socialiști va prelua guvernarea Caz MACABRU în Buzău: Și-a ținut ascunsă luni în șir mama decedată în spatele casei, pentru a-i încasa pensia Un urs a atacat în Comarnic echipa de intervenţie care încerca să-l alunge Prefectul judeţului Constanţa anunţă o anchetă administrativă după incendiul de la Secţia ATI a Spitalului de Boli Infecţioase VIDEO INCREDIBIL Klaus Iohannis s-a dezlănțuit la adresa Uniunii Europene și a Ungariei: 'Şi pe mine mă enervează' Vasile Bănescu reacționează ferm, după îndemnul progresiștilor de a-i scăpa pe copii de părinții lor - Progresesim alienant, regresism moral VIDEO - Marcel Ciolacu, la un pas să plece dintr-o emisiune / Anca Alexandrescu: 'Dar poate îmi dați și o palmă, domnule Ciolacu' Un raport DSU din 2020 confirmă dezastrul: Vlad Voiculescu nu a făcut nimic pentru spitalul din Constanța Restricții în București: Fără nunți, restaurante închise, program redus la magazine, carantină de noapte în weekend. De când se aplică? Ce spune Florin Cîțu despre introducerea stării de urgență în România? ""Pare bizar pentru șase milioane de persoane vaccinate"" Care sunt cele mai eficiente măsuri de prevenție și protecție împotriva COVID-19? Toți românii trebuie să știe Vestea șoc a momentului în România: Celebrul cântăreț a murit răpusă de coronavirus Decizia ŞOC luată de premierul Florin Cîțu, în urma cumplitului incendiu de la Constanţa. Este BREAKING NEWS Carantină de weekend în Bucureşti: Până la ce oră se poate circula? BREAKING NEWS Incredibil, dar adevărat! Ce salariu are o vânzătoare la Zara România! Câți lei câștigă lunar Lovitură uriaşă pentru familia lui Marcel Pavel! Nu se mai poate face nimic! Fiul său a păţit-o rău... Giorgiana Loredana Matei – între libertate absolută și dorința de a face carieră prin salvarea de vieți: „Studiați intens și munciți mult pentru a putea gusta din fericirea și împlinirea deplină!” Calendar Creștin Ortodox, 3 octombrie 2021. Ce sărbătoare este astăzi și se sfinți sunt pomeniți Declarația lui a lăsat-o mască pe Anamaria Prodan! Asta i-a pus capac și a decis să spună tot: „De asta suntem unde suntem! Păcat! Reghecampf este...” Andreea Tonciu, strigăt de ajutor! „Este internat de două săptămâni la spital și are nevoie de sânge” O campanie publicitara pe stiripesurse.ro! Formate standard si speciale Targetare geografica si orara Advertoriale si product placement Exclusivități și documente incendiare. Echipa stiripesurse.ro vă prezintă ştirile din spatele ştirilor. Cum circuli legal noaptea prin București dacă nu te-ai vaccinat. FORMULARELE necesare, potrivit legii Armata va livra benzină începând de luni în Marea Britanie Jandarmii au folosit spray lacrimogen la un protest la Rădăuţi - O persoană rănită în timpul incidentelor Termeni si Conditii | Politica de confidentialitate | Date personale | Politica cookie-uri | Publicitate | CONTACT | Modifică Setările Copyright © 2013-2019 www.stiripesurse.ro Nouă ne pasă ca datele tale personale să rămână confidențiale Noi și partenerii noștri stocăm și/sau accesăm informații pe un dispozitiv, cum ar fi identificatori unici în cookie-uri pentru procesarea datelor cu caracter personal. Puteți accepta sau gestiona preferințele dvs. făcând clic mai jos, inclusiv dreptul dvs. de a obiecta în cazul în care este utilizat interesul legitim sau în orice moment pe pagina cu politica de confidențialitate. Aceste alegeri vor fi raportate partenerilor noștri și nu vor afecta datele de navigare.Mai multe detalii Noi si partenerii nostri (retelele de socializare si agentiile de publicitate partenere, precum si furnizorii nostri de servicii de date analitice) prelucram date pentru a permite website-ului sa functioneze, pentru a personaliza continutul si anunturile publicitare afisate in functie de interesele si/sau profilul dvs., pentru a va oferi functionalitati aferente retelelor de socializare si pentru a analiza traficul pe website. Beneficiati de drepturile prevazute de art. 15-22 din GDPR in legatura cu prelucrarea datelor cu caracter personal. Aceste drepturi pot fi exercitate prin modalitatea indicata aici. Prin click pe “ACCEPT TOATE”, acceptati folosirea tuturor Tehnologiilor de tip Cookie, care implica inclusiv acceptul dvs. cu privire la stocarea/accesarea informatiilor de catre Vendor-ii cu care colaboram. Prin click pe “VREAU SA MODIFIC SETARILE INDIVIDUAL” puteti schimba preferintele in mod individual, mai putin cele legate de cookie strict necesare pentru functionarea website-ului. Atât noi, cât și partenerii noștri prelucrăm datele pentru a oferi: Aplicarea cercetărilor de piață pentru a genera informații despre audiență. Crearea unui profil de conținut personalizat. Măsurarea performanței reclamelor. Selectarea reclamelor personalizate. Crearea unui profil de reclame personalizate. Măsurarea performanței conținutului. Selectarea reclamelor de bază. Dezvoltarea și îmbunătățirea produselor. Stocarea și/sau accesarea informațiilor de pe un dispozitiv. Selectarea conținutului personalizat. Date precise de geolocație și identificarea prin scanarea dispozitivului.",8
"Isu Bekalan Cip Semikonduktor Buatan Malaysia Akan Berterusan Untuk Seketika , Tetapi Usaha Sedang Digiatkan Untuk Meningkatkan Pengeluaran","Isu Bekalan Cip Semikonduktor Buatan Malaysia Akan Berterusan Untuk Seketika, Tetapi Usaha Sedang Digiatkan Untuk Meningkatkan Pengeluaran DITERBITKAN PADA 03 OKT 2021. OLEH NAZRIN. Beberapa hari yang lalu kami ada melaporkan bahawa kadar kes positif wabak COVID-19 yang sedang membelenggu Malaysia adalah salah satu faktor yang menyebabkan kekurangan bekalan cip semikonduktor secara global. Malaysia adalah salah satu daripada beberapa negara yang merumahkan sejumlah kilang-kilang pembuatan cip semikonduktor ini, dan kebelakangan ini, banyak daripada mereka yang tidak boleh beroperasi pada kapasiti penuh sehingga hari ini. Badan-badan pengelola semikonduktor seperti Malaysia Semiconductor Industry Association mengatakan bahawa untuk industri tersebut, 12 bulan yang berlalu ini dikatakan sangat sukar sekali khususnya kerana kebanyakan kilang-kilang ini samada terpaksa tutup ataupun beroperasi pada kapasiti terhad untuk mengurangkan kebarangkalian penularan wabak tersebut. Walaupun begitu, kadar vaksinasi yang semakin meningkat, khususnya untuk sektor perindustrian memperlihatkan banyak daripada kilang-kilang ini kembali beroperasi pada kapasiti penuh kebelakangan ini, dan ini akan sedikit sebanyak membantu dalam memastikan bekalan cip semikonduktor dapat dikilangkan pada kadar yang sama sebelum wabak ini menular. Sama seperti syarikat-syarikat pembuat semikonduktor besar seperti TSMC, Intel, Samsung dan sebagainya, pihak MSIA juga telah menjalankan sebuah tinjauan, dan 16 daripada syarikat-syarikat semikonduktor yang bertapak di Malaysia berkata mereka akan melabur di Malaysia untuk menambahkan kapasiti pembuatan cip semikonduktor di kilang-kilang mereka dalam masa terdekat ini. Pelaburan tersebut, yang dijangka bernilai RM4 bilion, adalah untuk memenuhi permintaan cip semikonduktor global, khususnya apabila ia dijangka akan meningkat sebanyak 20 peratus pada tahun ini dan 10 peratus lagi pada tahun hadapan. Oleh kerana ini, Malaysia Pacific Industries turut mengatakan bahawa bekalan cip semikonduktor dijangka akan terus menghadapi masalah dalam masa terdekat ini khususnya kerana permintaan yang sangat tinggi dan akan terus meningkat di masa hadapan. Walaupun begitu, badan perindustrian tersebut juga menjangkakan bahawa industri pengilangan cip semikonduktor akan memperlihatkan peningkatan jualan dan keuntungan yang lebih tinggi dari tahun-ke-tahun, dan pelaburan yang akan dilakukan syarikat-syarikat ini untuk meningkatkan kapasiti mereka hanya bermakna bahawa masa hadapan industri ini sangat cerah. Jadi pertama untuk komen Aplikasi CaltexGO Untuk Mengisi Minyak Secara Nirtunai Kini Boleh Digunakan Di Malaysia Xpeng Robotic Unicorn Adalah Robot Kuda Sumbu Yang Boleh Ditunggang Kanak-Kanak",4
PS5 und Xbox Series X bleiben bis 2023 Mangelware,"PS5 und Xbox Series X bleiben bis 2023 Mangelware Ein weiterer großer Zulieferer geht davon aus, dass die Chipkrise anhalten wird. Seit im November 2020 die PS5 und Xbox Series X erschienen sind, sind sie kaum zu bekommen. Dass Sony und Microsoft nicht mit der Produktion nachkommen, liegt auch an der anhaltenden Chipkrise. Die Lage wird sich wohl auch nicht nächstes Jahr vollständig erholen. Toshiba geht davon aus, dass die Chipkrise bis 2023 anhält. Toshibas Direktor Takeshi Kamebuchi sagt zu Bloomberg, dass man einige Kund*innen erst wieder 2023 vollständig beliefern kann. Mit einer merkbaren Verbesserung der Verfügbarkeit wird man mindestens bis September 2022 warten müssen. Toshibas Power-Chips sind für die Energieversorgung in Geräten wichtig Toshiba stellt unter anderem Chips her, die die Spannung in Geräten regulieren. Sony und Microsoft gehören, so wie viele andere Tech-Unternehmen auch, zu den Abehmer*innen dieser Power-Chips. Zwar gibt es auch andere Hersteller*innen von Power-Chips, allerdings sind die Konsolen und Produktionsprozesse auf die Chips von Toshiba ausgelegt. Ein Wechsel ist also nicht ohne weiteres möglich. Außerdem müssten, weil es um die Stromversorgung und damit die Sicherheit geht, die Geräte neu zertifiziert werden. Außerdem leiden auch andere Hersteller*innen von Power-Chips unter denselben Problemen wie Toshiba. Laut Toshiba gäbe es immer noch Lieferengpässe bei den Materialen, die zur Herstellung der Chips nötig sind. Die Chipkrise geht über Spielkonsolen weit hinaus. Auch die Automobilindustrie ist stark davon betroffen. Hersteller*innen schicken Mitarbeiter*innen immer wieder auf Kurzarbeit, weil in Fabriken Chips fehlen, um Autos fertigzubauen. Toshiba priorisiert laut eigenen Angaben bei seinen Lieferungen die Automobilindustrie, weil der Chipmangel dort größere Auswirkungen habe. Tesla verklagt Tesla-Fahrer auf 780.000 Dollar Schadenersatz Außerordentliche Behauptungen und außerordentliche Beweise Was würde mit toten Menschen auf dem Mars passieren Chinesisches Elektro-SUV kostet nur 8.000 Euro Hat dir der Artikel gefallen? Jetzt teilen! (futurezone) | Stand: 05.09.2021, 8:59 Uhr Warum Chips knapp sind und was das bedeutet Chipmangel: Toyota produziert 40 Prozent weniger Autos Chip-Krise in der Autobranche: Infineon erhöht die Preise Wir würden hier gerne einen Outbrain Feed zeigen. Leider haben Sie uns hierfür keine Zustimmung gegeben. Wenn Sie diesen anzeigen wollen, stimmen sie bitte Outbrain UK Ltd zu. Outbrain UK Ltd Akzeptieren Cyber Security Challenge 2020 Das Internet der Dinge ist kein Trend, es ist die Zukunft Innovative Gründer im Porträt",1
Krisis Chip Otomotif Diprediksi hingga 2023,"Krisis Chip Otomotif Diprediksi hingga 2023 CNN Indonesia | Selasa, 07/09/2021 15:43 WIB Ilustrasi krisis chip semikonduktor untuk produk otomotif. (Foto: AP/Ng Han Guan) Jakarta, CNN Indonesia -- Kekurangan pasokan chip semikonduktor untuk produsen otomotif global diprediksi akan berlangsung hingga 2023. Penyebab utama krisis komponen itu akibat pandemi virus corona (Covid-19). Pandemi covid-19 telah menyebabkan lonjakan permintaan chip semikonduktor untuk perangkat elektronik. Di satu sisi, sektor otomotif kekurangan suplai komponen tersebut. Kondisi itu berimbas pada penghentian sementara jalur produksi kendaraan untuk sejumlah perusahaan otomotif. ""Kekurangan pasokan chip itu diproyeksi akan berlangsung enam hingga 2023,"" kata Paul Boudre, kepala eksekutif Soitec kepada Radio Classique Prancis mengutip AFP, Selasa (7/9). Soitec merupakan perusahaan penghasil chip semikonduktor untuk manufaktur smartphone, tablet, komputer, IT, dan pusat data yang berbasis di Isere, Paris. Krisis Chip, Produksi Suzuki India Anjlok September Soitec mempekerjakan lebih dari 1.600 orang dan mengharapkan penjualannya melonjak 40 persen menjadi $950 juta (Rp13,5 triliun) pada tahun fiskal perusahaan yang berakhir pada Juni 2022. ""Kami berada dalam situasi di mana industri otomotif beralih ke rantai pasokannya untuk memproduksi semikonduktor untuk mencari kapasitas produksi yang jauh lebih tinggi,"" ucap Boudre. Sebelumnya sejumlah pabrikan mobil ""meremehkan"" masalah dari kekurangan semikonduktor, dengan mengatakan ""itu akan terjadi dalam waktu singkat"". Namun situasinya telah berubah dan kian dirasakan banyak produsen otomotif global. Kekurangan ini juga terjadi karena industri sedang berusaha mempercepat peralihannya ke kendaraan listrik yang diperkirakan akan lebih meningkatkan permintaan semikonduktor. Menperin Targetkan RI Produksi Chip untuk Mobil dan Laptop Sementara itu Qualcomm Inc mengatakan akan memasok chip untuk dasbor digital di kendaraan listrik Renault SA baru. Qualcomm yang berbasis di San Diego, California, pemasok chip semikonduktor utama ponsel terbesar di dunia, telah berkembang ke industri kendaraan. Perusahaan awal tahun ini juga mengumumkan kesepakatan dengan General Motors Co untuk menggunakan chip Qualcomm. Menurut Qualcomm, Megane E-TECH Electric dari Renault akan menggunakan chipnya untuk memberi daya pada sistem infotainment kendaraan menggunakan perangkat lunak dari Google Alphabet Inc, sebagai mitra lama Qualcomm di pasar ponsel Android, melansir Money Control. Saksikan Video di Bawah Ini: VIDEO: Beli Mobil Impian Dengan Uang Koin Harga Avanza, Raize dan Rush dengan PPnBM 25 Persen 10 Ciri Kaki-kaki Mobil Bermasalah Ahli Sebut Penggerak Roda Depan Bukan Kendala di Tanjakan Cara Mengendarai Mobil Penggerak Roda Depan di Tanjakan Curam Fungsi Oli Mesin Kendaraan dan Alasan Wajib Diganti Polda Metro Jaya Anulir Tilang untuk Mobil Bawa Sepeda Sri Mulyani Gratiskan Pajak Mobil Baru Sampai Desember Terungkap, Warga Punya Mobil Masih Dapat Bansos Berlapis PPnBM dan PPN Dongkrak Penjualan Mobil dan Properti Waktu Terbaik Berhubungan Seks, Pria dan Wanita Berbeda Pantangan Makanan Bagi Pria Bertetek Besar Ahli Seks Ungkap 5 Cara Dapatkan Kepuasan Seks Terbaik Pria Jangan Terburu-buru saat Berhubungan Seks Pakar: UMKM Harus Siap ke Arah Digitalisasi 7 Kesalahan Pria saat Hubungan Seks Tautan Sponsor oleh Taboola VIDEO: Impresi City Hatchback, Harus Bisa Move On dari Jazz VIDEO: Digoda Fitur Canggih Wuling Almaz RS VIDEO: Rayuan SUV Miliaran Hyundai Palisade buat Para Sultan Hasil Liga Spanyol: Suarez Antar Atletico Hajar Barcelona 1 menit yang lalu Atletico Madrid menang 2-0 atas Barcelona pada pekan kedelapan Liga Spanyol di Stadion Wanda Metropolitano, Minggu (3/10) dini hari waktu Indonesia. Presiden Filipina Rodrigo Duterte Umumkan Mundur dari Politik 10 jam yang lalu Cerita Sharon Jadi Menteri BUMN Sehari Gantikan Erick Thohir 15 jam yang lalu Edo Kondologit-Raffi Ahmad Bakal Ramaikan Pembukaan PON Papua 16 jam yang lalu VIDEO: Kekaisaran Rusia Gelar Resepsi Pernikahan Internasional • 1 menit yang lalu 5 Aparat Tewas Disergap Milisi Taliban Pakistan Internasional • 31 menit yang lalu Satu Sisi Ahmad Dhani Hiburan • 1 minggu yang lalu Masjid Wal Adhuna, Saksi Bisu Tenggelamnya Daratan Jakarta Nasional • 21 jam yang lalu Hasil Kualifikasi MotoGP Amerika: Bagnaia Pole, Marquez Ke-3 Olahraga • 1 jam yang lalu Land Rover Pop Up Display Bertema James Bond di Jakarta Teknologi • 3 jam yang lalu Fakta-fakta 18 Pesawat Tempur TNI Melintasi Istana Merdeka 7 jam yang lalu Cara Mengetahui WA Sudah Dibaca Meski Centang Biru Nonaktif 9 jam yang lalu Motor Listrik Buatan Lokal Sukses Jajal Jakarta-Mandalika 8 jam yang lalu Menyajikan berita terhangat langsung melalui handphone Anda © 2021 Trans Media, CNN name, logo and all associated elements (R) and © 2021 Cable News Network, Inc. A Time Warner Company. All rights reserved. CNN and the CNN logo are registered marks of Cable News Network, Inc., displayed with permission. Tentang Kami | Redaksi | Pedoman Media Siber | Karir | Disclaimer",4
Decoded : Impact of semiconductor chip shortage on global economy,,0
